ID_A,ID_B,Title_A,Title_B,Model_Number_A,Model_Number_B,Brand_A,Brand_B,Price_A,Price_B
2296,5664,Lexmark 18C2249 36XL 37XL High-Yield Ink 500 Page-Yield 2 Pack Black,POWER SAVING BACK-UPS XS 1500,18C2249,BX1500G,Lexmark,APC,66.99,199.99
1501,880,REDIFORM OFFICE PRODUCTS                           Brownline Weekly Appointment Book w 30-Minute Schedule 7-5 8 x 10-1 4 Black 2012,Kingston ValueRAM 2GB Kit 2x1GB Modules 400MHz PC3200 DDR Desktop Memory KVR400AK2 2GR,,KVR400AK2/2GR,REDIFORM OFFICE PRODUCTS,Kingston,22.29,83.95
1226,18650,Vantec NexStar 2.5  SATA to USB 2.0 Hard Drive Dock,Bushnell Backtrack Point-5 Personal GPS Locator Gray,NST-D100S2,360200,Vantec,Bushnell,24.2,60.09
2367,11936,Rubbermaid Commercial Economical Round White Steel Step Can 1.5 gal,Coby 8 GB 2.8-Inch Video MP3 Player with Touchscreen FM Stereo Speaker MiniSD Card Slot and Camera Black,MST15EPL,MP828-8GBLK,Rubbermaid Commercial,Coby,41.97,47.88
2434,5757,Guardian Air Step Antifatigue Polypropylene Mat 36 X 60 Black,OmniMount MWFS Adjustable 2-Shelf Component Wall System with Cable Management - Espresso,24030502,MWFS,Guardian,OmniMount,50.97,165.43
183,21538,Targus Zierra Case for BlackBerry Playbook Tablet Black,4PORT USB Over Ip Access Mntr Up To 4USB Devices Over Tcp ip Ntwk,THZ053US,ID-DS0011-S1,Targus,SIIG,55.88,126.99
1719,13529,Kodak ESP 3250 All-in-One Printer Value Bundle,Seagate STAN500100 Momentus XT 500 GB Solid State Hybrid Hard Drive,,STAN500100,,Seagate,58.0,129.99
735,4292,Acer Diamond Black 11.6  Aspire One 722-BZ197 Laptop PC with AMD Dual-Core C-50 Processor and Windows 7 Home Premium,Atrend-Bbox A362-10Cp B Box Series Dual Speakers for Ford F150 Super Crew Cab 2009 and Up 10-Inch,LU.SFT02.068,A362-10CP,Acer,ATREND-BBOX,288.0,84.0
1985,11319,Gear Head Dual Laptop Cooling Fan CF3000U,Tripp Lite P568-010 HDMI Gold Digital Video Cable HDMI M M - 10ft,CF3000U,P568-010,Gear Head,Tripp Lite,15.0,10.96
36,17369,TomTom XXL 550,Vtech DECT 6.0 Accessory Cordless Handset Caller ID for LS6425 LS6426 LS6475 or LS6476 Series,1EP001901,,TomTom,VTech,169.95,45.41
787,9541,Da-Lite Video Spectra 1.5 Model C with CSR Manual Screen - 58 x 104 HDTV Format,Plantronics 38885-01 Voyager PRO UC B230 Standard,82980,38885-01,Da-Lite,Plantronics,736.99,124.99
1445,21160,Draper Matte White Signature Series E Electric Screen  - NTSC 200 diagonal,Strip CT-E17 Outlet Electrical Outlet,111324,5097,Draper,Da-Lite,2664.0,92.9
1196,17016,Targus 17  Platinum Blacktop Standard Laptop Computer Case Black Gray,Blue Strength 2 Samuel 22 11-33 on Black Passion Series Hard Plastic Case For LG Optimus S LS670,CPT301US,,Targus,KarenDeals,46.88,7.51
418,114,Da-Lite Da-Plex Standard Rear Projection Screen - 60 x 80 Video Format,Microsoft Wireless Laser Mouse 6000 V2.0 Mac Windows USB,27544,QVA-00001,Da-Lite,Microsoft,2931.99,19.55
1861,1561,Chicago White Sox Pink iPhone 4 Hard Case,Simplism Japan Nylon Sleeve Case for iPad and iPad 2 Simplism Green TR-NSIPAD-SG EN,FVA4556,TR-NSIPAD-SG/EN,Tribeca,Simplism Japan,29.99,29.54
1038,9766,Planar 997-2797-00 PL Series PL1910M LCD Monitor,Griffin GC01620 SmartWipes - 6 Pack,997-2797-00,GC01620,Planar,Griffin Technology,179.0,2.56
2014,9824,Xantech 29110Dbkit Designer Hidden Link Infrared Kit Black,OmniMount Tria 1 B - 1 Shelf Wall Furniture Black Dark Glass,29110DBKIT,Tria 1 B,Xantech,OmniMount,56.88,31.54
2238,17070,Verbatim 4.7GB 16X DVD-R Whilte Inkjet Printable 50 Packs Spindle Disc,Road Ready RRLAPTOP15 Universal Case For 15 Inch Laptop,95079,,Verbatim,Road Ready,16.14,169.99
2296,105,Lexmark 18C2249 36XL 37XL High-Yield Ink 500 Page-Yield 2 Pack Black,Canon MP41DHII 14-Digit GLOview LCD Two-Color Printing Desktop Calculator Black Red,18C2249,MP41DHII,Lexmark,Canon,66.99,58.08
2138,5306,Draper M1300 Cineperm Fixed Frame Screen - 250 diagonal NTSC Format,TRENDnet 200 Mbps Powerline AV Adapter with Bonus Outlet TPL-304E White,250020,TPL-304E,Draper,Trendware,2453.45,59.99
814,19261,Draper Glass Beaded Paragon Electric Screen - AV Format 20 x 20,New-KXFA135 Film Cartridge Film Roll Case Pack 1 - 513850,114084,,Draper,Panasonic,3794.5,80.63
2156,15674,Ape Case AC252 Tri-Fold Digital Camera Case   Passport Travel Wallet,LD Xerox Phaser 8500 8550 8560 Remanufactured 108R00675 Standard-Capacity Maintenance Kit,AC252,,Ape Case,4inkjets,18.88,89.99
186,18545,Case Logic 30 Capacity CD Case,New-Stanley Bostitch 03201 - AntiJam Desktop Heavy-Duty Stapler 60-Sheet Capacity Black - BOS03201,56349,,Case Logic,Stanley,15.99,54.55
1347,5632,Mavis Beacon Teaches Typing Platinum 20,RCA Indoor Outdoor Digital TV Antenna ANT806,15060,ANT806,Encore,RCA,24.98,17.09
1404,20621,Arkon CA8655 Car Charger,APC Smart-UPS SC SC1500 1500VA 2U Rackmount Tower UPS System,CA8655,SC1500,Arkon,APC,7.88,336.72
2220,20741,Kensington Wrist Pillow Foam Keyboard Platform Wrist Rest Black,HP GW405AT USB 2-Button Laser Mouse,34801,GW405AT,Kensington,HP,22.0,18.09
1907,5078,APC Performance SurgeArrest 11 Outlet with Phone Splitter and Coax Protection 120V,Garmin n vi 260 3.5-Inch Portable GPS Navigator,P11VT3,Nuvi 260,APC,Garmin,27.88,275.0
559,764,Magnavox MDV3000 F7 DVD Player w HDMI,Maxell UT-PU 190247 Ultra-Thin Headphones Purple,MDV3000/F7,UT-PU,Magnavox,Maxell,37.54,9.41
1706,21324,Marware MicroShell for iPad Black,Light-Duty Full Strip Desk Stapler 20 Sheet Capac,602956006664,,,Swingline,39.99,
502,6614,EDGE Tech 512MB ProShot 100x Compact Flash Memory Card,Netgear GS748TS ProSafe 48-port Gigabit Stackable Smart Switch,PE204365,GS748TS-100NAS,Edge Tech,Netgear,12.88,
2248,18870,Safco 3-Way Red Aluminum Convertible Hand Truck Cart,Avery High Visibility 2 x 4 Inch Labels Assorted Fluorescent Colors 150 Pack 5978,4074,5978,Safco Products,Avery,579.97,13.31
323,3501,Case Logic 72 Capacity Heavy Duty CD Wallet,Sony Media 21 in 1 External Multi Card Reader Writer MRWEA7,59253,MRWEA7,Case Logic,Sony,15.99,27.77
514,3776,Cables Unlimited 2 Port e-SATA Controller PCI Express Card,Olympus 228180 VG-120 Digital Camera Black,IOC-7707,228180,Cables Unlimited,Olympus,49.88,
1683,15264,Case Logic 17  Laptop Briefcase,Verbatim Store n Go SuperSpeed 1 TB USB 3.0 Portable Hard Drive 97395 Black,ENC-117BLACK,97395,Case Logic,Verbatim,24.88,118.63
2025,21700,Logitech N315 Lapdesk,Kingston memory - 1 GB KTM-TP3840 1G,N315,KTM-TP3840/1G,Logitech,Kingston,24.88,15.74
955,21942,Adesso Pro Mechanical Gaming Keyboard,Kodak EasyShare Touch M577 14 MP Digital Camera with 5x Optical Zoom and 3-Inch LCD Touchscreen in Red 8GB Accessory Kit,MKB-135B,Touch M577,Adesso,Kodak,74.88,139.95
2275,3831,Brother TC20 Laminated Tape Cartridge,HP Compaq Presario CQ5810 Desktop Computer - Black,TC20,CQ5810,Brother,HP,29.88,299.54
2020,17942,HON Metal Bookcase 34-1 2w x 12-5 8d x 81-1 8h,New-Seiko SLP2RLH - Self-Adhesive Address Labels 1-1 8 x 3-1 2 White 520 Box - SKPSLP2RLH,S82ABCP,,HON,Seiko,369.0,29.0
2430,133,Avery Shipping Labels with TrueBlock Technology 2 x 4 White 1000 Box,JVC GZ-HM550 High Definition Camcorder,8463,GZ-HM550,Avery,JVC,45.91,764.94
1369,13043,Rocstor G222R2-01 Rocpro 850 External Hard Drive,Hi-Capacity Camcorder Battery for Sony DCR-TRV120,G222R2-01,B-962-AZ34495,Rocstor,Battery-Biz,159.98,40.95
66,21307,Epson T020201 Color Ink Cartridge,XEROX 108R00648 Imaging unit for xerox phaser 7400 color laser printer magenta,T020201,108R00648,Epson,Xerox,27.0,179.2
680,19638,CyberPower 900 Joules 6-Outlet Surge Protector,S-Video 4 pin female to RCA Male bi-directional adapter,615,,CyberPower,Comprehensive,13.88,18.29
1452,8146,Logitech 920-003198 MK100 Classic Desktop Usb Ps 2 Compact Design,Samsill Microsoft 17-Inch MT Laptop Messenger Black  39008,920-003198,39008,Logitech,Samsill,17.88,46.59
1402,7209,Xerox Card Scanner 200 Scanner,D-Link KVM-121 2-Port Kb Video MSE Audio KVM Switch,Xerox Card Scanner 200,KVM-121,XEROX,D-Link,168.98,9.99
2313,13749,Digital Innovations Screen Dr. 5 oz Bottle with Cloth,Fujifilm FinePix Z70 12 MP Digital Camera with 5x Optical Zoom and 2.7-Inch LCD Silver,4110100,Z70 Silver,Digital Innovations,Fuji,9.88,111.25
1076,3127,Cables To Go 29109 Velocity Composite Video   Audio Cable,Griffin 8209-ITSPCC Screen Care Kit for iPod Touch,29109,8209-ITSPCC,Cables To Go,Griffin Technology,39.88,5.99
912,4802,Jaton GeForce 6200 256MB Video Card,Kingston Digital 32 GB USB 2.0 Hi-speed Datatraveler Flash Drive DT102 32GBZ Black,VIDEO-338PCI-LP,DT102/32GBZ,Jaton,Kingston,97.82,54.52
917,11323,IOGEAR Smartlink USB 2.0 Adapter,TRENDnet 300 Mbps Wireless N USB Adapter TEW-624UB Black,GUN262WV,TEW-624UB,IOGEAR,TRENDnet,16.23,33.99
1928,5732,ioSafe Rugged 500GB USB 3.0 Portable External Hard Drive,Panasonic KX-TG9322T 2-Line DECT 6.0 Cordless Phone Metallic Black 2 Handsets,PA50500U5YR,KX-TG9322T,IOSAFE,Panasonic,299.98,119.99
248,19389,Symantec Norton Anti Virus Dual Protection Software Mac,Samsung EC-ST65 Digital Camera with 14 MP and 5x Optical Zoom Silver,SYMCD11445MC,EC-ST65ZZBPSUS,Symantec,Samsung,69.99,99.0
1825,14192,Belkin F2N028-06-GLD Gold Series Monitor Replacement Cable,Brother 1 Inch x 26.2 Feet Black on White Tape with Super Strong Adhesive TZS251,F2N028-06-GLD,TZS251,Belkin,Brother,7.88,15.83
710,15800,Griffin iPod Touch 4G Screen Care Kit 3 Pack,Innovera D5210 3412916 Compatible Remanufactured Toner - 20 000 Page-Yield Black,GB01913,D5210,Arkon,Innovera,13.3,90.58
1051,15877,Hammermill Color Laser Gloss Paper 8-1 2 Pack of 300 Sheets,X340 X342 Photoconductor Kit,163110,X340H22G,Hammermill,Lexmark,8.94,57.24
1559,17221,Ape Case Standard DSLR Holster,Universal 43725 - Dry Erase Board Melamine 72 x 48 White Black Gray Aluminum Plastic Frame,ACPRO650,,Ape Case,Universal,29.88,357.0
292,10951,Belkin Mini CD Drive Cleaning Kit,HP 2.4 GHz Wireless Optical Mobile Mouse Silver,F8E648,WE790AA#ABA,Belkin,HP,7.82,22.76
2253,12755,3m O-Cel-O Sponge With 3m Stayfresh Technology 4pk,Lowepro Rezo 110 AW Camera Bag,7274T,34700,3M,Lowepro,2.69,24.14
2432,19571,Da-Lite Silver Matte Model C Manual Screen - 7 x 9 AV Format,Lexmark 32 Black Print Cartridge Twin Pack 18C0533,90545,18C0532,Da-Lite,Lexmark,454.5,39.12
226,14137,Cables Unlimited 3 SVGA Video Cable HDB15 Male to Male With 3.5mm Audio,Syba CL-SPK20068 Self Powered Portable Black Mini Speakers Recharge by USB CL-SPK20068,PCM-2240-03,CL-SPK20068,Cables Unlimited,Syba,11.88,18.88
1998,19534,D-Link DGS-1005G 5-Port Gigabit Desktop Switch,New-FELLOWES 8036001 PROFESSIONAL SERIES PREMIER KEYBOARD TRAY - FLW8036001,DGS1005G,,D-Link,Fellowes,27.88,223.2
862,2004,Chief Manufacturing Dual Swing Arm LCD Wall Mount,Belkin Pivot-Plug Surge Protectors,,BP112230-08,Chief Manufacturing,Belkin,143.2,30.55
2358,14594,Coby 7  LCD Portable DVD CD MP3 Player,Motorola W408g Prepaid Phone Net10,TFDVD7379,w408g,Coby,Motorola,85.71,19.99
2287,15573,TracFone LG 420G with 60 Minutes Card Refurbished,Cables Unlimited USB-1610 All in One Internal Card Reader with USB 2.0 3.5 Inch Beige,DSV.TF420GR4.60C,USB-1610,Tracfone,Cables Unlimited,19.88,19.98
2090,9035,Netgear ProSafe GS716T 16-Port Ethernet Switch,HON10593CC - 10500 Series Double Pedestal Desk,GS716T-200NAS,,NETGEAR,Hon,238.0,586.0
2242,16301,Cables To Go 16898 USB To PARALLEL ADAPTER,New-Acroprint 010182000 - ES700 Digital Atomic Time Recorder Black - ACP010182000,16898,,Cables To Go,Acroprint,20.88,376.0
1322,1406,Fellowes 91441 Gel Crystal Mouse Pad with Wrist Rest,Great White 16202-4 11 x17 Recycled Copy Paper 500-Sheet -Pack,91441,16202-4,Fellowes,Hammermill,14.88,11.08
333,6827,Draper Glass Beaded Apex Manual Screen - 6 diagonal NTSC Format,Kingston DataTraveler 108 8 GB Flash Drive DT108 8GBZ,205021,DT108/8GBZ,Draper,Kingston,665.99,8.95
368,15403,Draper Matte White Salara Plug and Play Electric Screen - NTSC 7 diagonal,Da-Lite Compact-4 Height Adjustable Workstation,136007,,Draper,Da-Lite,624.25,223.99
1703,6929,Pendaflex Interior File Folders Top Tab 100 Box,iLuv iCC613PNK Silicone Case with 3D Pattern for iPod touch 4G Pink,421013BLA,iCC613PNK,,iLuv,20.94,10.58
651,12646,Draper M2500 Access Series V Electric Screen  - HDTV 119 diagonal,Buffalo Technology LinkStation Pro 2 TB High Performance Network Attached Storage LS-V2.0TL Black,102301,LS-V2.0TL,Draper,Buffalo Technology,2107.95,199.99
781,3170,ATI FirePro V7800 2GB PCI Express 2.0 Graphics Card,EVGA GeForce GT 520 1024 MB DDR3 PCI-Express 2.0 Graphics Card 01G-P3-1521-KR,100505604,01G-P3-1521-KR,ATI,EVGA,739.82,55.17
473,19283,Targus Truss Case for iPad Black Blue,Logio Secure Password Organizer Black with Pouch Neck Lanyard,THZ06103US,LG10B,Targus,Atek Electronics,69.88,28.23
1578,3521,foldIO P2 Leather Texture Folio Case for iPad 2 Black,Sony 50DMR47RS4 16x DVD-R Discs 50 Disc Spindle,IPD2FLBK,50DMR47LS3/T,Scosche,Sony,44.88,14.2
2323,3538,Gear Head Wireless Optical Tilt-Wheel Mouse Red,Simplism Japan Leather Flip Note Case for iPad 2 - Navy TR-LFNCIPD2-NV EN,MPT3200RED,TR-LFNCIPD2-NV/EN,Gear Head,Simplism Japan,19.88,59.99
423,19952,Sabrent 3.5  USB 3.0 SATA HDD Enclosure,Quartet MPPC - Magnetic Push Pins for Magnetic Planning Boards Assorted Colors 20 Pack,EC-35UK,,Sabrent,Quartet,26.88,22.0
2223,10210,Da-Lite Video Spectra 1.5 Model C Manual Screen - 69 x 92 Video Format,NEC MultiSync EA221WM-BK 22 inch 1680X1050 DVI 5MS SPK USB Wide LCD Black Monitor,82969,EA221WM-BK,Da-Lite,NEC,472.99,250.38
1500,18893,Officemate Plastic Coated Paper Clips Assorted Colors 800pk,Roxio Easy CD DVD Burning,97228,,Officemate,Roxio,8.88,18.99
2528,6415,Verbatim 100-Pack 16X DataLifePlus Shiny Silver DVD-R Spindle,New Digital Camera Hard Carry Case Blue for SONY CANON CASIO JVC Cameras 1 Super Fine Microfiber Cleaning Cloth Goja Logo,97017,,Verbatim,Goja,29.98,9.99
741,16407,Avery Allstate-Style Legal Side Tab Divider Title A Letter White 25 Pack,New-Universal 10311 - Pressboard Classification Folders Legal Six-Section Cobalt Blue 10 Box - UNV10311,82163,,Avery,Universal,5.69,86.92
748,12314,Encore Hoyle Card Games 2011 Casual Gaming,Avery Disk Organizer Pages Acid Free Pack of 10 75222,21331,75222,Encore,Avery,19.99,8.34
2535,8314,Rubbermaid Extra Deep Desk Drawer Director Tray Plastic Black,Microsoft Visio Standard 2010,,D86-04533,Rubbermaid,Microsoft,7.94,210.44
565,12081,BIC Brite Liner Highlighter Chisel Tip Pink 1-Dozen,Peak PKC0BO 400 Watt Tailgate Power Inverter,BL11-PNK,PKC0BO,BIC,Peak,5.88,39.97
334,18785,Pilot BeGreen B2P Roller Ball Retractable Gel Ink Pen Red 5 count,56K Serial Controller Faxmodem,,USR5686G,,USRobotics,7.5,88.23
1137,13614,Elite Screens CineGray Prime Vision Series Fixed Frame Screen - 135 Diagonal,RAM Mounting Systems RAM-B-149Z-MA10U Handlebar Mount for Magellan MobileMapper 6 Triton 1500 2000,PVR135H1,RAM-B-149Z-MA10U,Elite Screens,RAM,1069.0,31.4
1093,1149,OCZ Technology Vertex 2 60GB 2.5  SATA II Solid State Drive,Fantom GreenDrive 2 TB USB 2.0 eSATA External Hard Drive GD2000EU32,OCZSSD22VTXE60G,Fantom Green Drive,OCZ Technologies,Fantom,119.98,116.14
1186,1713,Griffin iPad Airstrap,Pyle PLPADFM2B Bluetooth iPod iPad iPhone Car Player and Gooseneck Mount with Wireless FM Transmitter,GB01759,PLPADFM2B,Griffin Technology,Pyle,39.99,43.19
1359,9017,Safco Onyx Mesh Desk Organizer 8 Sections 11 3 8w x 9 1 2d x 13h Black,HP 56 Black Ink Cartridge in Retail Packaging C6656AN 140,3266BL,HEWC6656AN,,HP,47.94,21.5
454,2135,Incipio AK-334 Kaddy Nylon Folio For Amazon Kindle 3 Black,Sony DCR-HC21 MiniDV Handycam Camcorder w 20x Optical Zoom,AK-334,DCRHC21,INCIPIO,Sony,28.5,
2521,15410,Peerless SmartMount Universal Flat Mount 32 - 50 Screens,StarTech.com Professional USB VGA External Dual or Multi Monitor Video Adapter USB2VGAPRO,SF650,USB2VGAPRO,Peerless,StarTech,64.99,87.87
1582,17047,StarTech.com SAT3510BU2V USB to SATA External Hard Drive Enclosure,New-Brother DK1219 - Die-Cut Round Paper Labels 1 2 dia 1200 Roll White - BRTDK1219,SAT3510BU2V,,StarTech,Brother,28.88,30.0
483,5204,EDGE 8GB 4X2GB PC38500 ECC UNBUFFERED 240 PIN DDR3 KIT APPLE,Wintec Filemate 32 GB Swivel USB Drive - Blue,PE22177504,3FMUSB32GWN-R,EDGE,Wintec,139.82,44.94
2393,22053,Case Logic 13.3  Black Neoprene Notebook Sleeve,Dell Primary Battery - Notebook battery - 1 x lithium ion 9-cell 85 Wh,PLS-13 BLACK,Primary Battery,Case Logic,Dell,20.0,61.55
2263,5987,SIIG 3.5  SATA SuperSpeed USB 3.0 Hard Drive Enclosure,Altego 15.6-Inch Clear Laptop Sleeve - Pink,JU-SA0A12-S1,36023,SIIG,Samsill,31.5,18.16
1153,21352,Magnavox DVD Recorder and 4-Head Hi-Fi Stereo VCR ZV457MG9,Verbatim Store n Go 2 GB U3 Smart Flash Drive 95326 Silver,ZV457MG9,95326,Magnavox,Verbatim,171.54,22.04
912,6554,Jaton GeForce 6200 256MB Video Card,Canon PGI-225 BK CLI-226 C M Y 4 Pack Value Pack 4530B008 in Retail Packaging,VIDEO-338PCI-LP,4530B008,Jaton,Canon,97.82,44.95
801,16950,Diamond Multimedia Stealth ATI Radeon 9250 256MB PCI Video Card,Smead 74795 - Tuff Pocket Seven Inch Expansion File Pockets Straight Legal Redrope 5 Box,S9250PCI256SB,,Diamond Multimedia,Smead,59.0,
1194,19622,Ape Case AC165 Digital Camera Case,XEROX 113R00656 Print cartridge for xerox phaser 4500 black,AC165,113R00656,Ape Case,Xerox,12.85,134.11
121,2043,JVC KD-R320 CD Receiver,42PT350 42 Class Plasma HDTV With TruSlim Frame Smart Energy Saving 600Hz Sub Field Driving,KDR320,,JVC,LG,70.0,
1416,5718,Adobe Software Production Premium CS5.5 PC,Patriot Signature Dash 32 GB Capless USB 2.0 Flash Drive PSF32GDUSB,ADBCD21340WIAE,PSF32GDUSB,Adobe,Patriot,449.0,38.99
2492,11223,Tripp Lite SmartPro 1500VA UPS,ASUS WL330GE Wireless pocket access point,SMART1500RM2U,WL-330gE,Tripp Lite,Asus,499.0,43.99
2023,9713,PC Tools Spyware Doctor 2011 1year User 3 PCs for Pc,PowerGain CineTension2 Series Tension Electric Motorized Screen - 84 Diagonal Size 92 Diagonal,21072828,,Symantec,Elite,17.82,835.0
1981,6719,Sony MDRAS30G Sport Headphones - Behind The Neck,SprayGround SprayLoud Baseline Headphones Yellow Purple,MDRAS30G,SL1020,Sony,Sakar,19.88,56.95
681,17714,CP Technologies LevelOne OAN-0501 Omni-Directional Antenna,AT T 945 4-Line Corded Telephone with Speakerphone,OAN-0501,945,CP TECH,AT T,15.71,
60,7044,Samsung TL205 Refurbished 12.2MP Black Digital Camera 6.3-18.9mm f 3.2 3x Zoom Lens 2.7  Dual LCD VGA Movie Recording w 50 Bonus Prints,GTMax Camera Carrying Pouch Case with Strap- Black Blue for Canon PowerShot G12 SX30 IS SX130 SX230 IS SX20 IS HF M32 HF21 HF S21 FujiFilm S2800HD Panasonic Lumix FZ40 FZ45 FZ100 G1 G2 G3 GF1 GF2 GF3,RBTL205,,Samsung,GTMax,79.0,15.99
168,12957,Sony Premium EX Earbuds MDREX57LP BLK,Imation Defender H200 Biometrics 2.5INCH External Hard Drive 500GB Fips 140-2,MDREX57LP/BLK,27820,Sony,Imation,39.99,377.7
267,3765,Iomega eGo 500GB Helium Portable Hard Drive,ORANGE BLACKBERRY CURVE 8330 PHONE FOR SPRINT - NO CONTRACT REQUIRED - 5.0 OPERATING SYSTEM,34945,BLACKBERRY CURVE 8330,Iomega,BlackBerry,78.98,
16,2880,Avery Self-Adhesive Filing Labels 1 3 Cut 3-7 16 x 2 3 Clear 450 Pack,Belkin iPod Touch Grip Ergo w Strap-Black,5029,F8Z653ttC00,Avery,Belkin,21.47,12.49
2174,13448,Draper Glass Beaded Access Series E Electric Screen  - NTSC 15 diagonal,Sony Reader Touch Edition PRSA-CP65 P - Case for eBook reader - pink,104047,PRSA-CP65/P,Draper,Sony,1615.0,13.73
640,16883,Audiosource BI5 5  In-Wall Construction Bracket Mount,New-Bankers Box 1231101 - Super Stor Drawer Steel Plus Storage Box Letter Kraft Green 6 Carton - FEL1231101,BI5,,AudioSource,Bankers Box,25.88,
738,680,Lexmark T650A11A Black Toner Print Cartridge,Buffalo Technology Drivestation Quattro 2.0TB 4X500GB Desktop External Hard Drive FireWire Combo with TurboUSB2.0 HD-QS2.0TSU2 R5 Black,T650A11A,HD-RQS2TSU2/R5,Lexmark,Buffalo Technology,202.87,499.68
281,6508,Da-Lite Da-Tex Rear Tensioned Advantage Electrol - HDTV Format 184 diagonal,ARKON CMP128 ADHESIVE CAMERA VIDEO RECORDER DASHBOARD MOUNT,35199,,Da-Lite,Arkon,4612.99,17.95
740,3767,Read Right PathKleen Printer Roller Cleaner Sheets 8 1 2 10pk,OPTI-UPS SS1200 Stabilizer Series 6-Outlet Automatic Voltage Regulator 600W 1200VA,RR1237,SS1200,READ RIGHT,Opti UPS,9.84,22.99
525,4469,Disney Fairies Notebook,Clickfree Automatic Wireless Backup C3 1 TB USB 2.0 Portable External Hard Drive 1028Wi Piano Black,,1028Wi,Disney,Clickfree,0.0,182.26
1824,8055,Dart Plastic Vented Lids 1000ct,10 LED Wireless IP Camera with 10 Meter Night Vision and 3.6mm Lens 270 Viewing Angle with Two Way Audio Monitoring AGC - Color Black,12JL,,,db,21.97,63.88
1944,20430,Kenwood 6  5-Way Performance Series Flush Mount Speakers 500 Watts,Da-Lite 27660 Da-Glas Deluxe Rear Projection Screen - 72 x 96 Video Format,KFC-6993PS,,Kenwood,Da-Lite,84.99,
1833,15193,Arkon SGT-7SS Sun Shade for Samsung Galaxy Tab,X21 DLP Proj XGA 500 1 4 3 2700 Lumens VGA Svid Rca 4.85LBS,SGT-7SS,X21,Arkon,3M,16.88,695.99
1633,5676,Case Logic High Zoom Camera Case,PNY OPTIMA 512MB DDR 400 MHz PC3200 Desktop DIMM Memory Module MD0512SD1-400,152256,MD0512SD1-400,Case Logic,PNY,17.59,16.92
2177,15327,Draper M1300 Clarion Fixed Frame Screen - 124 x 124 diagonal AV Format,TRENDnet 16-Port Gigabit Web Smart Switch 16x 10 100 1000Mbps Auto-Negotiation and Auto-MDIX ports 2x Mini-GBIC TEG-160WS Black,252007,TEG-160WS,Draper,TRENDnet,1724.99,152.99
1606,7649,Da-Lite Da-Plex Deluxe Rear Projection Screen - 36 x 48 Video Format,GEAR HEAD LLC 58-In-1 Card Reader with 3-Port USB 2.0 Hub Computer Memory CR7500H Black,27559,CR7500H,Da-Lite,Gear Head,1630.99,11.92
34,6588,Sunpak 72-In-One Card Reader with SIM Slot,Cables Unlimited PCM-2200-06B HDB15 Male to Female SVGA Cable 6 feet,72-IN-1-CR,PCM-2200-06B,Sunpak,Cables Unlimited,0.0,17.69
821,2605,Asus ENGT430 DC GeForce GT430 1GB DDR3 Graphics Card,Toshiba 46SL417U 46-Inch 1080p 120 Hz LED-LCD HDTV with Net TV Black,ENGT430 DC S/DI/1GD3,46SL417U,Asus,Toshiba,84.88,
688,19595,StarTech.com PEX1P 1 Port PCIe DP Parallel Adapter Card,HP 94 Black Ink Cartridge in Retail Packaging C8765WN 140,PEX1P,C8765WN#140,StarTech,HP,32.88,22.59
2447,11828,Avery Matte White CD Labels for Color Laser Printers and Copiers 30 Disc Labels and 60 Spine Labels,Nexaira Business Class II 3G 4G High Availability Router,6692,R-SI-NEX-BC-B209,Avery,Nexaira,14.88,179.29
465,1342,Viore 24  Class 1080p LCD HDTV 60Hz - Choose Your Color,V7 CAT5e Network Patch Cable RJ45 Male to Male Green 1-Foot  V7N3C5E-01F-GRN,LC24VF56WT,V7N3C5E-01F-GRN,Viore,V7,179.0,2.6
2040,10369,StarTech.com PM1115U Fast Ethernet Print Server,Adobe Acrobat Standard 8.0,PM1115U,12020350,StarTech,Adobe,40.84,
2537,6487,Gator Cases ATA Molded Utility Case 11.7 x 16.7 x 5.9,Comprehensive IEEE-1394 Firewire- 6 Pin Jack to 4 Pin Plug Adapter,GXDF-1116-5-TSA,,Gator Cases,Comprehensive,139.99,14.95
712,2430,Premiertek PowerLink Wireless 802.11b g n High Power USB 2.0 Adapter,Adesso Carrying Case for iPad Black,PT-H9DN,ACS-100FB,PREMIERTEK,Adesso,31.88,15.96
336,16709,Midland 40-Channel Mobile CB Radio with Weather Scan Technology,New-Seiko SLP2RLE - Self-Adhesive Address Labels 1-1 2 x 3-1 2 White 520 Box - SKPSLP2RLE,1001LWX,,Midland,Seiko,69.99,
138,2104,Night Owl Optics APOLLO-45 4-Channel H.264 500GB DVR Kit,Sylvania DVD8728 7-Inch LCD Dual Screen Portable DVD Player Black,APOLLO-45,DVD8728-Black,Night Owl,Curtis,338.0,
805,21785,Belkin Grip Ergo for iPod,Case for Apple Imac 20 with Keyboard and Accessory Storage Compartment,F8Z524TT064,,Belkin,Road Ready,10.54,249.99
1613,484,3M Porcelain Marker Board Steel Backed 4 x3 Aluminum,GE 45606 Z-Wave Technology 2-Way Dimmer Switch,,45606,3M,General Electric,246.59,43.29
2331,16598,Advantus Badge Straps w Clip Vinyl 3 8 w 100 Box,Da-Lite 97989 Da-Tex Rear Tensioned Cosmopolitan Electrol - AV Format 10 6 x 14 diagonal,75410,,,Da-Lite,18.94,
2468,5836,US Brown Bear Full Motion Series Medium Dual Arm Mount for 23 - 37 Displays in Silver,Intermatic EJ351C 120 Volt 24-Hour Programmable Mechanical Security Timer,,EJ351C,US Brown Bear,Intermatic,59.99,19.07
375,16172,Avery Mailing Seals 200ct White,Dry-All DRY-ALLWSPEK-90 Wet Smartphone Emergency Kit Accs Dry Out Multiple Wet Smartphones,06740,,Avery,HPL LLC,0.0,46.76
1111,10296,Pyle iPod 3.5mm Stereo To RCA Adapter,Bazooka BT1224DVC BT Series 12-Inch 4-Ohm Dual Passive Tube,PLIPG1,BT1224DVC,Pyle,Bazooka,6.54,149.99
2509,19638,Sanus Powerbridge in Wall Power and Cable Management,S-Video 4 pin female to RCA Male bi-directional adapter,,,Sanus,Comprehensive,84.99,18.29
914,15638,Kensington 15.4  Classic Nylon Laptop Sleeve Black,Polaroid PUMP PEP37BLU Stereo In-Ear Headphones Blue,K62562US,PEP37BLU,Kensington,Polaroid,20.88,3.98
1690,18922,Smead Acid-Free Poly Folder 2 Fasteners 1 3 Cut Top Tab Letter Manila 24 Box,Avery 16282 - Printable Repositionable Plastic Tabs 1 3 4 Inch White 80 Pack,10545,,,Avery,42.94,
1923,19908,Avery Postage Meter Labels for Personal Post Office E700 1-3 16 x 6 White 60 Pack,VIZIO Remote Control VR1,5289,0980-0304-9160,Avery,Vizio,9.54,24.47
412,10777,Hitachi 500GB Touro Mobile USB 2.0 Hard Drive,LaCie d2 Quadra v3 Hard Disk 2 TB eSATA FireWire800 USB 3.0 Desktop External Hard Drive 301543U Aluminum,0S03121,301543U,Hitachi,LaCie,64.98,225.0
919,7542,Coby 7  LCD Dual Screen Tablet Portable DVD Player,Sennheiser HDR 160 - Supplemental RS160 Wireless Headphones Charger Transmitter not included,TFDVD7752,HDR 160,Coby,Sennheiser,139.29,99.95
1231,16013,Maxell MyGen USB 4GB Auto Photo Backup,Toshiba Satellite L775D-S7220 17.3-Inch LED Laptop Grey,665107,PSK40U-00R003,Maxell,Toshiba,26.88,549.99
1756,17214,Crucial Technology 64GB m4 2.5  SATA Solid State Drive Kit,ZAX 85910 SELECT SERIES RF COAXIAL F-PIN CABLE 10 M,CT064M4SSD2CCA,,Crucial Technology,ZAX,159.15,
892,12767,Sabrent SATA to IDE Ultra ATA Mini Converter Board,Logitech Wireless Mouse M305 Forest Green,SBT-SCIDE,910-001896,Sabrent,Logitech,10.88,22.49
101,5684,Bling Software 123 Copy DVD 2010 Windows,Sunpak Platinum Plus 48-Inch Compact Travel Tripod with 3-way Panhead for Digital Cameras and Camcorders,80244,SUN50TRI,Bling Software,SunPak,32.98,8.95
573,10904,Microsoft Wireless Laser Desktop 3000 Keyboard and Mouse Combo,Imagelab FS5CO5 5 Megapixel Slide and Negative Scanner,NUD-00001,FS5C05,Microsoft,Image Lab,29.82,88.0
