ID_A,ID_B,Title_A,Title_B,Model_Number_A,Model_Number_B,Brand_A,Brand_B,Price_A,Price_B
1549,2172,Whistler Laser Radar Detector with Enhanced High Performance Improved Ka Band Sensitivity Ka Max Mode,rooCASE Dual Station Premium Leather Magenta Case Cover with Stand for Apple iPad 2 Wifi 3G Model 16GB 32GB 64GB,XTR690 SE,,Whistler,rooCASE,178.88,29.92
2278,3925,Mutant MIG-PS1-3 Media Yo Yo Amplified Speaker White,Coby DP700BLK 7-Inch Digital Picture Frame Black,MIG-PS1-3,DP700BLK,Mutant,Coby,14.88,29.26
1628,12098,Targus 15.6  Spruce EcoSmart Messenger Bag,StarTech.com 8-Inch LFH 59 Male to Dual Female DVI I DMS 59 Cable DMSDVIDVI1,TBM015US,DMSDVIDVI1,Targus,StarTech,56.63,14.99
1825,11460,Belkin F2N028-06-GLD Gold Series Monitor Replacement Cable,Sony VCT-50AV Remote Control Tripod for use with Compatible Sony Camcorders,F2N028-06-GLD,VCT-50AV,Belkin,Sony,7.88,51.33
2019,13127,Wintec FileMate 4GB CompactFlash Memory Card,Franklin TES-118 English Spanish Translator,3FMCF4GB-R,TES-118,Wintec,Franklin Electronics,15.98,
1702,13938,Smead Folders Front Interior Pocket Straight End Tab Letter Manila 50 Box,Westcott 15179 - Kleenearth Scissors 8 Length 3-1 4 Cut 2 Pack,24117,,,Westcott,45.94,
633,9630,EVGA Nvidia GeForce GT 430 Graphics Card with 1024MB DDR3 Memory,Samsung Replacement USB Data Charging Cable for Samsung SPH-M330 SCH-R100 SGH-T939 SCH-R850,01G-P3-1430-LR,APCBU10BBEBSTD,EVGA,Samsung,82.92,1.61
1338,19414,Kroo iPad iCap Black,Outfit Mist Touch 4G Teal wht,11929,GB02008,Kroo,Griffin Technology,28.88,14.54
91,12057,Dane-Elec 8GB High-Speed Compact Flash Memory Card,ViewSonic VA2431WM 24-Inch Widescreen LCD Monitor with Speakers,DACF3008GC,VA2431WM,DANE-ELEC,ViewSonic,44.88,
1067,1850,Belkin 12 Y Audio Cable,Nikon Coolpix S5100 12 MP Digital Camera with 5x Optical Vibration Reduction VR Zoom and 2.7-Inch LCD Blue,F8V235-12,S580 Blue,Belkin,Nikon,4.87,
1292,18544,Peerless Slimline Universal Ultra Slim Tilt Mount for 22 to 40 Ultra Thin Screens Weighing Up to 60 lb,New-Stanley Bostitch B5000BLK - Antimicrobial Full Strip Metal Stapler 20-Sheet Capacity Black - BOSB5000BLK,,,Peerless,Stanley,143.99,34.61
1546,12226,Royal DS3 Postal Rate Scale,Brother TN-620 Toner Cartridge,DS3,TN620,Royal,Brother,24.54,47.99
2043,4319,Draper Truss-Style Dress Kit Black Velour,Ape Case Ac252 Tri-Fold Travel Wallet Digital Camera Case Camcorder Bags Camera Bags,222045,,Draper,Ape Case,1584.0,
1100,19210,Philips GoGear Ariaz MP3 Player,Brother TZ Tape Cartridge for P-Touch Labeler 1-1 2w Black on White,SA3ARA08K/37,,Philips,Brother,78.88,20.45
533,19301,Vantec Nexstar3 2.5  SATA to USB 2.0 and eSATA External Hard Drive Enclosure Midnight Blue,Imation - 20 x CD-R - 700 MB 80min 52x - slim jewel case - storage media,NST-260SU-BL,,Vantec,Imation,23.0,16.99
2113,6091,Da-Lite Video Spectra 1.5 Model C with CSR Manual Screen - 7 x 9 AV Format,ASUS Skype Videophone and Photo Frame SV1TPW White,82976,VIDEOPHONE Photo SV1TPW,Da-Lite,Asus,697.99,203.23
655,10060,Case Logic Universal MP3 Armband Clear Front Panel Gray,Yamaha YDS-12BL iPod Dock Black,UMA-102GRAY,YDS-12BL,Case Logic,Yamaha,10.09,64.98
1675,20836,Storex Portable File Storage Box w Organizer Lid Black,Optoma TX542 XGA 2800 lumen networkable DLP Multimedia Projector,61510U01C,TX542,,Optoma,25.0,1299.99
665,21415,Adobe Photoshop and Premiere Elements 9 Windows and Mac,Black iPhone 4 4G LCD Touch Digitizer Screen Assembly,65087226,,Adobe,OEM SYSTEMS COMPANY,140.7,51.0
2076,1486,iFrogz iPod iPhone Lux Car Charger Red,Speck PixelSkin for iPod touch 2G 3G Green,CHARGERLUXRED,IT2-PXL-GRN,iFrogz,Speck,11.0,4.95
2320,16907,StarTech.com PYO3SATA 4in SATA Power Y Splitter Adapter Cable,MAXSA INNOVATIONS 47774 SOLAR MARKER LIGHT BLUE,PYO3SATA,,StarTech,Sharp,8.88,16.0
1310,2906,EDGE 256MB 1X256MB PC2100 NONECC UNBUFFERED 184 PIN DDR DIMM,jWIN JBM44 PC Gaming Stereo Backphone with Microphone,PE158842,JBM44,EDGE,jWIN,11.88,
2460,17456,Sony Eyepiece Cup,New-Cardinal 11957 - Heavyweight Vinyl Slant-D Ring Binder With Finger Hole 5 Capacity Maroon - CRD11957,FDAEP5AM,,Sony,Cardinal,12.0,61.0
415,6867,Sony BDP-S360 1080p Blu-ray Disc Player- Refurbished,iTEKIRO AC Wall DC Car Battery Charger Kit for Pentax D-BC72 iTEKIRO MP3 MP4 Mini Speaker,RBBDP-S360,Pentax D-BC72,Sony,iTEKIRO,79.0,14.94
722,8256,Peerless Paramount Articulating Flat Panel Wall Arm 37 to 60 Screens,Nebraska Cornhuskers iPhone 3G Silicone Cover,,,Peerless,Tribeca,209.99,17.99
1553,2544,Ematic Universal eBook Reader Accessory Kit,4 Pack Of Compatible Toner Cartridges 1 Black 1 Cyan 1 Magenta 1 Yellow For Use With HP LaserJet 2550 2820 And 2840 Printers,EA103,HP LJ 2550 Series Printers,Ematic,Ink Tank,18.88,69.0
243,18970,Post-it Notes Original Notes Canary Yellow,New-MIDLAND XTC100VP2 MICRO-ACTION CAMERA WITH ASSORTED MOUNTS - MDLXTC100VP2,659YW,,POST-IT,Midland,45.0,104.75
1504,13244,Avery 2  Heavy Duty View Binder with EZD Ring Navy Blue,Wintec FileMate Imagine Series K2010 USB Standard Keyboard - Jet Black 3FMNK2010UBK-R,79802,3FMNK2010UBK-R,Avery,Wintec,7.97,15.99
1381,9257,Samsung C3050 GSM Cell Phone Gray Unlocked,Western Digital 250 GB SATA 3.0 Gb-s 64 MB Cache 3.5-Inch Internal Bare-OEM Drives WD2503ABYX,C3050,WD2503ABYX,Samsung,Western Digital,74.99,64.99
2490,19783,Chief Manufacturing Thinstall Universal Fixed Wall Mount 37 - 63 Displays,HP CE250A Black Toner Cartridge -Remanufactured,,CE-250X,Chief Manufacturing,Compatible,129.0,56.76
1454,17500,Sharpie Stainless Steel Permanent Marker Fine Tip Black,10500 Series Corner Unit,1747388,,Sharpie,Hon,7.94,346.81
1740,12922,rooCASE 2-Pack Capacitive Stylus for iPad 2 Tablet,IOGEAR 50-in-1 USB 2.0 Pocket Flash Memory Card Reader Writer GFR210 Silver,218564,GFR210,rooCASE,Iogear,19.99,13.99
320,9327,Toshiba DVR670 DVD VHS Recorder with Built-in Tuner,V7 CAT5e Snagless Molded Network Patch Cable RJ45 Male to Male Green 1-Foot  V7N3C5E-01F-GRNS,DVR670,V7N3C5E-01F-GRNS,Toshiba,V7,214.0,2.71
2317,6541,Zagg InvisibleSHIELD for iPad 2,CaseCrown Vertical Multi Pocket Messenger Bag Black for the Apple iPad and iPad 2,APPIPADTWOLE,,Zagg,CaseCrown,39.99,32.18
194,7150,Epson S041378 Photographic Papers,Epson Amer Matte Presentation Paper 27 Lbs. Matte 8-1 2 X 11 100 Sheets Pack,S041378,,Epson,Epson,59.88,20.45
1883,2288,Michigan Wolverines iPhone 3G Silicone Cover,Bower XUSON Sony Rapid Universal Charger,FVA2158,XUSON,Tribeca,Bower,19.99,15.77
1931,12626,Targus iPad Deluxe Zierra Case and Accessory Bundle Black,Cables Unlimited SWB-9000 2 Port PS 2 KVM Switch with built-in cables 1 Pack Silver,BUS0250,SWB9000,Targus,Cables Unlimited,79.99,29.8
657,19847,Canon AC Adapter Kit For Powershot-SD900 SD800IS SD700IS,Mini Mirco USB Cable,ACK-DC30,TACC-RMMC90GR,Canon,Innergie,52.88,14.29
1167,13109,Dell Switch Black 15.6  Inspiron i15R-7223DBK Laptop PC with Intel Core i3-2310M Processor Windows 7 Home Premium with Bonus Your Choice Color Pattern Lid Bundle,Gear Head 2.4 GHz Wireless Laser Tilt-Wheel Mouse - Stealth Black LMT3600BLK,,LMT3600BLK,Dell,Gear Head,578.0,
1048,10325,PC Treasures External DVD-RW Drive Pink,Avervision 300AF Padded Carrying Case,07186,VIS3AFPCC,PC Treasures,AVerMedia,57.74,29.99
1950,19221,BIC Ecolutions Mechanical Pencil 0.7mm Black 24-count,Antec 92MM SMARTCOOL Thermally Controlled 92mm Case Fan,MPEP241-BLK,92mm SmartCool,BIC,Antec,7.29,13.88
1981,22065,Sony MDRAS30G Sport Headphones - Behind The Neck,Middle Atlantic Slim Power Strip PD-2415SC-NS - Power distribution strip - 24 output connector s,MDRAS30G,PD-2415SC-NS,Sony,Middle Atlantic,19.88,101.32
1800,585,Five Star 1-Subject Wirebound Wide Rule Notebook Red 5 pack,Coby CA84 USB Travel Adapter Charger Kit White,,CA84,,Coby,9.5,10.16
552,8412,Sony Creative Software Download Loops Standard Collection,Allsop 3D Mouse Pad-Lightning 30379,MDLSC10,30379,Sony,Allsop,28.82,8.99
894,6045,Samsung 470 Series 128GB SATA II Solid State Drive,TRENDnet 2-Port PS 2 KVM Switch Kit Includes 2x KVM Cables TK-205K Blue,MZ-5PA128/US,TK-205K,Samsung,TRENDnet,199.0,18.33
412,20637,Hitachi 500GB Touro Mobile USB 2.0 Hard Drive,2n1 - Neoprene Black Sleeve Case and KLIC-7003 Battery for Kodak EasyShare M380 Digital Camera Black,0S03121,M380,Hitachi,Young Micro,64.98,15.95
705,3692,PC Pitstop PC Matic,High Power Lexington Designer Manual Screen - 100 diagonal AV Format Size 96 x 96,PCMATIC5PC1003,,PC Pitstop,Da-Lite,49.99,
1098,21920,Bower Pro Series Case for SLRs DSLRs,Cooler Master Storm Inferno 4000 dpi Gaming Mouse SGM-4000-KLLN1-GP,Bower SCB950,SGM-4000-KLLN1-GP,Bower,Cooler Master,18.98,43.99
2462,7117,FileMate Imagine Series K2010 USB Standard Keyboard,Fellowes 32057 Powershred P-57Cs Shredder,,P-57Cs,,Fellowes,15.12,68.25
1669,8613,Netgear FVS318G-100NAS ProSafe Firewall - 8 x 10 100 1000Base-T  LAN 1 x 10 100 1000Base-T  WAN,Canon PowerShot ELPH 300 HS 12 MP CMOS Digital Camera with Full 1080p HD Video Red,FVS318G-100NAS,ELPH 300 HS - RD,NETGEAR,Canon,118.0,229.0
204,8344,Sharpie Pen Retractable Fine Point Pens Black Set of 2,Avery 5498 Removable Print or Write Color Coding Labels for Laser Printers 1-1 4 Round - Neon Green Pack of 400,,5498,Sharpie,Avery,5.88,7.05
2548,18174,Draper Glass Beaded Targa Electric Screen  - HDTV 119 diagonal,Wilson Jones 38344B - Basic Vinyl D-Ring Binder 2 Capacity Black,116241,,Draper,Wilson Jones,807.45,
762,20384,Plantronics  73079-01 AC Power Adapter for Telephone Headset System,BSXCBBASEH - Curved Base for Rectangular Table 28H Bourbon Cherry,73079-01,,Plantronics,Basyx,14.88,211.81
1061,1774,Da-Lite Da-Plex Self Trimming Rear Projection Screen - 58 x 104 HDTV Format,1GB PC3200 1GBx1 Memory Upgrade 4 DELL Dimension 1100 2400 800MHz 3000 800MHz 8300 800MHz B110 OptiPlex GX270 DT 800MHz GX270 MT 800MHz GX270 SD 800MHz GX270 SF 800MHz GX270 SMT 800MHz,27590,Dell Dimension Memory,Da-Lite,Computer Memory Solutions,4635.99,17.99
2402,14166,Amzer Luxe Argyle High-Gloss Skin Case for Samsung GALAXY Smoke Gray,M-Edge Touring Sleeve for iPad 1 and 2 - Black PAD1 S1 N B,89721,PAD1_S1_N_B,AMZER,M-edge,14.88,32.5
1097,17594,SIIG 2.5  USB 2.0 to SATA Hard Drive Enclosure,New-S J Paper S13649 - Water Paper Cut-Resistant End Tab Folders Two Fasteners Letter Purple 50 Box - SJPS13649,JU-SA0C12-S1,,SIIG,S J Paper,12.88,55.0
1257,14005,Netgear Wireless-N 150 Access Point WN604,VIZIO M420SV 42 Inch Class Edge Lit Razor LED LCD HDTV with VIZIO Internet Apps,WN604-100NAS,M420SV,NETGEAR,Vizio,55.88,728.0
908,14562,Zalman N Series SSD0064N1 MLC 64GB Internal SATA II Solid State Drive,Boss BV7300 3.2-Inch In-Dash Widescreen TFT Monitor DVD MP3 CD Receiver,SSD0064N1,BV7300,ZALMAN USA INC,BOSS,144.0,87.91
1447,18842,BIC Grip Roller Pen 0.5mm Black 1-Dozen,Performance Plus Remanufactured HP94 Black Inkjet Cartridge C8765WN 94,GREM11-BLK,C8765WN #94,BIC,Performance Plus,10.99,5.06
671,10018,Centon 8GB DataStick Pro USB Flash Drive 2-Pack Bundle,Avery Marks-A-Lot Dry Erase Markers Black Blue Green and Red Pack of 4 24409,,24409,,Avery,24.0,3.99
1817,18645,Lexmark E450H11A Toner 11000 Page-Yield Black,Casio Exilim EX-Z16 12 MP Digital Camera with 3x Zoom and 2.7-Inch LCD Black,E450H11A,EX-Z16BK,Lexmark,Casio,248.27,98.0
270,17270,AT T - HTC Aria Smartphone Price with New 2-yr Contract,New-S J Paper S11546 - Water Cut-Resistant Folder Two Fasteners 1 3 Top Tab Letter Blue 50 Box - SJPS11546,Aria,,AT T,S J Paper,320.0,58.0
1467,6192,rooCASE Executive Leather Portfolio Case for Samsung Galaxy Tab P1000,LG Optimus GT540 Unlocked GSM Quad-Band Phone with 3 MP Camera Android OS Touch Screen Wi-Fi Bluetooth -No Warranty - Titanium Silver,212537,GT540EUSLV,rooCASE,LG,37.59,132.76
983,968,Startech 10 ft. HD 15mm VGA Monitor Cable,IOGEAR 8-Port VGA CAT5e 6 Audio Video Splitter GVS148TX Black,MXT101MM10,GVS148TX,StarTech,Iogear,10.98,272.99
1829,20489,Kimberly-Clark Professional Scott C-Fold White Paper Towels 200 sheets 12 ct,Western Digital WD Scorpio Black 500 GB SATA 3 GB s 7200 RPM 16 MB Cache Internal Bulk OEM 2.5-Inch Mobile Hard Drive,01510,WD5000BEKT,KIMBERLY-CLARK PROFESSIONAL,Western Digital,61.97,77.95
816,8104,Draper M1300 ShadowBox Clarion Fixed Frame Screen - 133 diagonal HDTV Format,Sumdex PON-367BU Full Speed Armor Backpack for up to 15.6 Inch PC Blue,253018,PON-367BU,Draper,Sumdex,1195.99,39.99
1079,9535,Draper M2500 Premier Electric Screen Premier 132 WideScreen M2500 - WideScreen 132 diagonal,Sony 25DPW47RS2 DVD RW Re-Recordable DVD 25-Pack Spindle,101213,25DPW47LS2,Draper,Sony,1907.95,13.99
714,11280,Roxio Easy CD and DVD Burning 2011 Windows,Verbatim 96732 DataLifePlus 8.5 GB 2.4x-6x Double Layer Recordable Shiny Silver Disc DVD R DL 50 Disc Spindle,249000,96732,ROXIO,Verbatim,27.88,57.24
1422,5571,TOPS JAMMIT Pocket Wirebound Notebook Ruled 9 White 100 Sheets per Pad,Sangean SR-35 AM FM Analog Pocket Radio,65100,SR-35,TOPS BUSINESS FORMS,Sangean,7.94,22.41
2534,20894,Draper IRUS Rear Projection Screen with System 100 Black Frame - 92 diagonal NTSC Format,Sceptre X320BV-HD 32 720p LCD TV - Black,125106,X320BV-HD,Draper,Sceptre Inc.,4196.7,259.0
2233,5249,rooCASE 3-in-1 Kit - Wood Grain Design TPU Skin Case for iPad 2,Verbatim Clip-IT 4 GB USB 2.0 Flash Drive 97556 Pink,218462,97549,rooCASE,Verbatim,27.99,10.98
2102,21614,Elite M150XWV1 Screens Manual Projection Screen,Standard Capacity Maintanence Kit for Phaser 8500 8550,M150XWV1,108R00675,Elite Screens,Tektronix,187.84,99.99
756,9242,MSW Wireless Jawbone Icon Bluetooth Headset Mesh,ARKON SR088-TS-1 SatRadio Mount 15-Inch Flexible Steel Seat Bolt Mount CM088TS1 AP012,JBG01MS,SR088-TS-1,Jawbone,Arkon,72.98,24.95
1143,19536,HP AR482AT Internal Blu-ray Writer,New-deflect-o 63304 - Super Tray Unbreakable Countertop Tray Set Two Tier Plastic Black - DEF63304,AR482AT,,HP,Deflect-O,149.82,33.42
592,18434,Sabrent USB 2.0 to DB25F Parallel Printer Cable,GE 76352 Phone Installation Wire White,USB-DB25F,76352,Sabrent,General Electric,9.88,19.84
822,10391,Centon 8GB SDHC Memory Card,AirLink101 AWLL5088 Wireless N 150 Ultra Mini USB Adapter,RC8GBSDHC4,AWLL5088,CENTON,AirLink,17.49,13.81
1742,2792,Maxell Juicy Tunes Earbuds Green,MEA45388 - Notebook College Ruled 200 Sheets 5-1 2x4 Assorted,190242 JT-PU,,Maxell,Mead,9.88,1.49
352,21362,Acer Iconia Tab with Wi-Fi 10.1  Touchscreen Tablet PC Featuring Android 3.0 Honeycomb Operating System Aluminum Metallic - 32GB,Magnetic Marker Board Erasers,A500-10S32u,,Acer,Sparco,498.0,5.85
2153,16679,D-Link AirPremier N Dual Band PoE Access Point,New-TOPS 46147 - Purchase Order Book 8-1 2 x 11 Three-Part Carbonless 50 Sets Book - TOP46147,DAP-2590,,D-Link,Tops,318.0,
1984,21788,Incipio Smart Feather for Apple iPad 2 Lime,3M Precise Optical Mousing Surface MP200PS,IPAD-228,MP200PS,INCIPIO,3M,33.25,6.22
2216,10390,Luxor Three Shelf EnduraTable Extra Wide Workstation,Aleratec 300115 16x LightScribe Duplicator Grade DVD R 600 Pack,LEW35-B,300115,Luxor,Aleratec,369.99,371.99
779,19199,BIC Triumph 730R 0.5mm Needle Point Roller Pen Black 4 Ct. 2-Pack,Nikon COOLPIX L120 14.1 MP Digital Camera with 21x NIKKOR Wide-Angle Optical Zoom Lens and 3-Inch LCD Red,,L120 Red,,Nikon,11.28,299.95
863,5294,Nokia Travel Charger,Avery-Style Legal Side Tab Dividers 25-Tab Blank,279044,,Nokia,Avery,20.53,
43,1734,Sony MDREX35LP VB Colorful Headphone with Case - Violet Blue,Plantronics GameCom777 Gaming Headset,MDREX35LP/VB,Plantronics GameCom777,Sony,Plantronics,13.54,58.24
356,21662,jWIN Mega Bass Pro Headphones,BenQ projector MS612ST,IHP605BLK,9H.J4177.14E,JWin,BenQ,37.88,
912,11150,Jaton GeForce 6200 256MB Video Card,Elgato Video Capture Device White,VIDEO-338PCI-LP,10020840,Jaton,Elgato,97.82,77.99
1470,17211,Whistler RLC-360 GPS Module,Elmer s E304 - Washable School Glue 4 oz Liquid,RLC-360,,Whistler,Elmer's,62.88,20.52
620,21080,GiiNii 7  Digital Picture Frame White Stardust,Sony Micro Vault Click 16 GB USB 2.0 Flash Drive with Virtual Expander USM16GL,GB-711P-B,USM16GL,Giinii,Sony,74.0,36.99
1974,12271,ioSafe Solo - 1 TB Fireproof Waterproof External Hard Drive includes 1k Disaster Recovery Service,MW811ST MW811ST,SL1000GBUSB20,MW811ST,IOSAFE,BenQ,199.58,678.99
388,9206,EVGA 1GB GeForce GT 520 DDR3 Graphics Card,Zotac Nvidia GeForce GTX 550 Ti GPU with 192-bit Memory Bus 1 GB GDDR5 Memory 900MHz 4100MHz ZT-50401-10L,01GP31521KR,ZT-50401-10L,EVGA,Zotac,68.99,158.57
1666,8217,GN Netcom 9125-30-15 Jabra GN9125 Wireless Micro-boom Earset,Mobile Edge - 16 Inch EVO Backpack - Black with Blue Trim,9125-30-15,MEEVO3,GN Netcom,Mobile Edge,289.88,44.99
275,14289,DYMO D1 Standard Tape Cartridge for Dymo Label Makers 3 8in x 23ft Red on White,Arkon GPS032 GPS and Smartphone Waterproof Hard case with Bicycle and Motorcycle Mount Black,45018,GPS032,Dymo,Arkon,17.47,19.82
32,3259,Chicago Bears Camera Case,X-ACTO 1031 - Model KS Manual Pencil Sharpener Table- or Wall-Mount Black Chrome,FVA2782,,Tribeca,X-Acto,19.99,32.19
146,14717,Case Logic Medium SLR Camera Bag,GBC 51005 HeatSeal UltraClear Thermal Laminating Pouches Business Card Size 5 Mil 2 3 16 in. x 3 11 16 in. Pack Of 100,133827,51005,Case Logic,GBC,47.99,16.19
1140,8624,Dell 10.1  Inspiron Mini Duo iD-4495 Netbook PC with Intel Atom N570 Processor and Windows 7 Home Premium,Canon EF 70-300mm f 4-5.6 IS USM Lens for Canon EOS SLR Cameras,,0345B002,,Canon,598.0,499.0
36,10168,TomTom XXL 550,MLB Boston Red Sox iPhone Faceplate,1EP001901,B3G115,TomTom,Siskiyou,169.95,14.17
615,14410,Atrend-Bbox A361-12CP B Box Series  Speaker,Crucial Technology CT12864AA800 1 GB 240-pin DIMM DDR2 PC2-6400 CL 6 Unbuffered NON-ECC DDR2-800 1.8V 128Meg x 64 Memory,A361-12CP,CT12864AA800,Atrend,Crucial,56.88,12.99
2084,16426,Cables Unlimited SATA II 3Gbps to eSATA Cable with Straight Connectors,New-Smead 56030 - Self-Tab Card Guides Blank 1 3 Tab Manila 4 x 6 100 Box - SMD56030,FLT-6600-39,,Cables Unlimited,Smead,9.82,24.0
680,7663,CyberPower 900 Joules 6-Outlet Surge Protector,Q-See QSDT42DPCRC 4 Channel H.264 PCI DVR Card,615,QSDT42DPCRC,CyberPower,Q-See,13.88,229.71
856,11152,Endust LCD and Plasma Screen Cleaner for Small Screens,ProHT Headphone - Stereo,11575,,Endust,Inland,17.84,28.5
543,21569,Epson T078320 Claria Hi-Definition Magenta Ink Cartridge for Epson Stylus Photo Printers,Lexmark 16 Black Ink Cartridge 10N0016,T078320,10N0016,Epson,Lexmark,16.84,29.99
2401,13617,BenQ MS510 3D-Ready DLP Projector,Quick 8.0MP WebCam with Auto Focus Black,MS510,WC4750AFB,BenQ,Gear Head,599.0,
1443,3352,Aleratec Inc Aleratec Copy Cruiser Mini Hard Drive Duplicator Dock,TRENDnet ProView Pan Tilt Zoom Internet Surveillance Camera TV-IP600 White,350107,TV-IP600,Aleratec,TRENDnet,129.82,137.84
2163,17087,Oki 41945601 Fuser Kit,Raptor-Gaming LM3,4.1945601E7,,OKI,Raptor-Gaming,247.0,39.96
2344,21618,Kodak M552 Dark Pink 14MP Digital Camera Bundle w 5x Optical Zoom 2.7  LCD Display w 50 Bonus Prints,Sunpak CF-7057-CP Camera Filter,M552 Pink Bndl,CF-7057-CP,Kodak,Slik,109.0,10.3
119,2877,HOUSE OF DOOLITTLE                                 Express Track Daily Appointment Book Monthly Planner 5 x 8 Black 2012,Kingston Technology 2 GB Kit 2x1 GB Memory for Select Apple Desktops Dual Channel Kit 400 MHz PC 3200 184-Pin DDR SDRAM KTA-G5400 2G,,KTA-G5400/2G,HOUSE OF DOOLITTLE,Kingston,15.19,78.95
859,12939,Netgear ProSafe SRX5308 4-Port VPN Appliance,1GB 184PIN Ddr PC2100 266MHZ D,SRX5308-100NAS,PE192068,NETGEAR,Edge,448.0,
204,6279,Sharpie Pen Retractable Fine Point Pens Black Set of 2,Avery 05247 - Print or Write Mailing Seals 1in dia. White 600 Pack,,,Sharpie,Avery,5.88,
197,17874,Draper Matte White Envoy Electric Screen  - NTSC 150 diagonal,Smead 20630 - Recycled Card Size File Folders 1 3 Cut Top Tab 9 x 6 Manila 100 Box,112018,,Draper,Smead,1456.0,
2507,6345,Dixie Sage 8-1 2 Inch Paper Plates 125ct,Adobe Production Premium CS 5.5 Software Suite for Mac Upsell From Apple Final Cut Pro,SXP9SCDX,,Dixie,Adobe,21.97,849.95
1507,17217,Wilson Jones Super Heavy Weight Sheet Protector,Mauricio Rua Mouse Pad,21402,,Wilson Jones,WinCraft,10.94,18.99
1593,12273,Zax 87303 Pro Series 3m Composite Audio Video Cable,HP 7-Inch Digital Photo Frame Black,87303,DF730,Zax,HP,10.88,61.39
696,12501,Clarion Sirius Satellite Radio Receiver Adapter,Corsair CMX8GX3M4A1600C9 XMS3 8 GB PC3-12800 Core i5 Memory Kit,CLASC1,CMX8GX3M4A1600C9,Clarion,Corsair,49.99,79.99
2385,1034,Rubbermaid Commercial Yellow Wavebrake Bucket Downward Pressure Wringer Combination 44 qt,HP Laserjet CE505X Black Print Cartridge,757688YW,CE505X,Rubbermaid Commercial,HP,219.97,
1243,11425,Gear Head 2.4GHz Wireless Optical Nano Mouse Black,StarTech.com Professional 630 Watt ATX12V 2.3 80 Plus Computer Modular Power Supply ATX ATX2PW630PRO,MP2800BLK,ATX2PW630PRO,Gear Head,StarTech,15.82,104.75
2521,16395,Peerless SmartMount Universal Flat Mount 32 - 50 Screens,Oxford 10072 - Imperial Series Laserview Business Portfolio Cover Stock Blue 10 Pack,SF650,,Peerless,Oxford,64.99,
1060,19241,Vizio 22  ultra slim design RBM220VA Refurbished,Comprehensive s PRO-HEX Crimp Tool Frame,RBM220VA,,Vizio,Comprehensive,169.99,
357,9195,Epson T008201 Color Ink Cartridge for Stylus Color 780 870 875DC 875DCS and 890,D-Link DWL-P50 Power over Ethernet PoE Adapter,T008201,DWL-P50,Epson,D-Link,20.84,27.45
1209,21676,Xantech 283Dmw Designer Blink Emitter Single Mini Wire,GE Cordless Phone Nimh 3.6V 700mAh Battery 76413,283DMW,76413,Xantech,General Electric,11.88,9.07
4,21158,D-Link DCS-1100 Network Camera,Nuo Tech Kailo Chic Slim Sleeve-Hexagon - Pattern Black White Hexagons,DCS-1100,101023,D-Link,Navarre,99.82,25.19
1889,7836,Logitech Wireless Mouse Dark Fleur,Koss PORTABLE Replacement Cushions,910001898,Koss PORT REPLACEMENT CUSHIONS,Logitech,Koss,27.82,4.33
2431,833,Da-Lite Da-Plex Thru-the-Wall Rear Projection Screen - 81 x 108 Video Format,Lexmark 33 factory OEM Color Print Cartridge,23096,18C0033,Da-Lite,Lexmark,10048.99,16.99
168,20314,Sony Premium EX Earbuds MDREX57LP BLK,New-Avery 5429 - Erasable ID Labels 7 8 x 2-7 8 White 80 Pack - AVE5429,MDREX57LP/BLK,,Sony,Avery,39.99,5.88
2,13539,Epson 1500 Hours 200W UHE Projector Lamp ELPLP12,IPAD 2 HOT PINK TPU CASE,ELPLP12,,Epson,ARCLYTE TECHNOLOGIES  INC.,438.84,14.66
248,4364,Symantec Norton Anti Virus Dual Protection Software Mac,3M Gold Privacy Filter-3M GPF13.3W9 Widescreen Notebook Privacy Screen 16 9,SYMCD11445MC,GPF 13.3W9,Symantec,3M,69.99,38.82
308,8187,NEC 22  LCD Monitor Black EA221WM-BK,OSD Audio AP525 Outdoor High Definition Patio Speaker Pair White,EA221WM-BK,AP525 White,NEC,OSD Audio,249.0,87.62
1948,10093,Chief Manufacturing Adjustable Dual Plasma LCD Display Floor Stand Stand Only  30 - 50 Screens,Toshiba 55UL610U Cinema Series 55-Inch 1080p 480 Hz Local Dimming 3D LED-LCD HDTV with Net TV Black,,55UL610U,Chief Manufacturing,Toshiba,700.99,2199.99
978,13709,Audiovox XM Satellite Radio Cables for Eclipse Car Stereos,Pantech CDM8999 Crux Rubberized Shield Hard Case - Blue,CNPECL1,,Audiovox,Pantech,19.98,0.73
2391,20756,Da-Lite Video Spectra 1.5 Model B Manual Screen - 84 x 84 AV Format,FEL21100 - BookLift Copyholder,83225,,Da-Lite,Fellowes,139.99,16.98
708,9000,LG 42  ultra- slim 42LV5500,HP 564 Magenta Ink Cartridge in Retail Packaging,42LV5500,CB319WN#140,LG,HP,879.0,6.98
188,12746,Kingston ValueRAM 2GB DDR3 SDRAM Desktop Memory Module,Lowrance Elite-5x 5-Inch Waterproof Fishfinder,KVR1333D3LS4R9S/2G,000-00102-001,Kingston,Lowrance,63.88,
2195,13196,Fellowes HD Precision Cordless Mouse,DYMO 3 4 Inch Flexible Industrial Strength Nylon Labels for Rhino 5000 Label Printer White 18489,98904,18489,Fellowes,DYMO,44.84,12.99
22,10820,IOGEAR 2-Port MiniView Micro USB PLUS KVM Switch,Kingston 2 GB DDR2 SDRAM Memory Module 2 GB 1 x 2 GB 800MHz DDR2800 PC26400 DDR2 SDRAM KTD-INSP6000C 2G,GCS632UW6,KTD-INSP6000C/2G,IOGEAR,Kingston,37.57,25.99
145,3127,Case Logic 16  Value Laptop Briefcase Black,Griffin 8209-ITSPCC Screen Care Kit for iPod Touch,VNCI116BLACK,8209-ITSPCC,Case Logic,Griffin Technology,22.0,5.99
1630,13458,Draper High Contrast Grey Rolleramic Electric Screen - AV Format 70 x 70,Sony MDR-XB500 40mm XB Diaphragm Driver Extra Bass Headphones,115164,MDR-XB500,Draper,Sony,1363.5,49.54
1478,189,Actiontec MegaPlug 85Mbps Powerline Ethernet Adapter Kit Two-Pack,Panasonic SDR-S70K Camcorder Black,HLE0850001K,SDR-S70K,ActionTec,Panasonic,69.99,185.0
706,7429,JVC Lightweight Folding Headphones with Bass Boost Black,STM Convoy Medium laptop Backpack DP-0960-3,HAS600B,DP-0960-3,JVC,STM,49.95,74.19
967,6594,Belkin Gold Series High-Speed USB 2.0 Cable 6 ft.,Cables To Go 40314 Velocity High-Speed HDMI Cable 3.2 Feet 1 Meter Blue,F3U133V06GLD,40314,Belkin,Cables To Go,29.99,14.34
2391,6458,Da-Lite Video Spectra 1.5 Model B Manual Screen - 84 x 84 AV Format,CORSAIR XMS2 1GB PC2-6400 800MHz 240-pin DDR2 CL5 Dual Channel Desktop Memory - CM2X1024-6400,83225,CM2X1024-6400,Da-Lite,Corsair,139.99,15.99
532,476,Wireless Mobile Mouse 6000 BlueTrack Red,750GB Rocpro 850 Esata 7200 Rpm 32MB USB FW800 Carrying Case Int,MHC-00019,G222M2-R1,Microsoft,Rocstorage,29.88,
729,20998,rooCASE Light N Slim Carrying Bag for 10.1  Netbook iPad or iPad 2,Da-Lite Advance Quick Link QLW-1622 - Mounting kit wall bracket bracket single pivot mounting tube for TV and monitor - steel - black - screen size 19 - 21 - wall-mountable,210826,QLW-1622,rooCASE,Da-Lite,27.99,
1920,16384,Creative Labs D100 Speakers Green,Rediform 50111 - Wirebound Call Register 8-1 2 x 11 3 700 Forms Book,MF8090AA004,,Creative Labs,Rediform,79.99,
427,10888,iLive iPhone Alarm Clock Speaker,Inland Pro 6-Sheet Paper Shredder 05301,iSP191B,05301,iLive,Inland,42.88,28.54
1303,15815,iHOME Rechargeable Collapsible Portable Mini Multimedia Speakers Silver,HP PS 2 2-BUTTON Optical Scroll Mouse,IHM79SC,EY703AA,iHome,HP,47.55,9.22
368,13811,Draper Matte White Salara Plug and Play Electric Screen - NTSC 7 diagonal,Energizer A23 Battery 12 Volt - 2 Pack,136007,A23BP-2,Draper,Energizer,624.25,3.1
1770,2493,Middle Atlantic HDR-4 External Fan Option,Diaper Dude Black Coated Grey Laptop Sleeve 15-Inch Digi-Lp15Cc400,HDR-FAN,DIGI-LP15CC400,Middle Atlantic,Diaper Dude,55.99,32.0
