ID_A,ID_B,Title_A,Title_B,Model_Number_A,Model_Number_B,Brand_A,Brand_B,Price_A,Price_B
1860,14365,Dixie Viridian Insulair EcoSmart 8 Ounce Hot Cups 30ct,3M 3700F - Permanent Adhesive White Recycled Mailing Labels 2 3 x 3-7 16 1500 Pack,VIRECO0108,,Dixie,3M,3.59,
976,16311,StarTech.com PEX13943 4 Port PCIe 1394a FireWire Adapter Card,MMF Industries 2013004W47 - Slotted Rack Key Tags Plastic 1-1 2 x 1-1 2 Assorted 20 Pack,PEX13943,,StarTech,MMF,34.88,
1470,21024,Whistler RLC-360 GPS Module,HP Photo Value Pack Custom 57 Series,RLC-360,Q7926AN#140,Whistler,HP,62.88,22.49
404,18122,Draper DiamondScreen Rear Projection Screen with No Frame - 96 diagonal NTSC Format,New-Bankers Box 00784 - Hang N Stor Storage Box Letter Lift-off Lid White Blue 4 Carton - FEL00784,127105,,Draper,Bankers Box,6797.5,38.99
615,6347,Atrend-Bbox A361-12CP B Box Series  Speaker,ADESSO 10FT ACCELL USB 2.0 GOLD SERIES A B A001C-010B,A361-12CP,A001C-010B,Atrend,Adesso,56.88,8.21
2385,7330,Rubbermaid Commercial Yellow Wavebrake Bucket Downward Pressure Wringer Combination 44 qt,Universal 10312 - Pressboard Classification Folders Legal Six-Section Emerald Green 10 Box,757688YW,,Rubbermaid Commercial,Universal,219.97,24.44
1227,19011,Sony Cyber-shot DSC-T110 16MP Digital Camera Red w 4x Optical Zoom HD Movie Capture 3.0  Touchscreen LCD w 50 Bonus Prints,Da-Lite Model C with CSR - Projection screen - 1 1 - Silver Matte,DSC-T110/R,With CSR,Sony,Da-Lite,219.99,362.5
791,4607,Lenovo Gray 15.6  IdeaPad Y560-064654YU Laptop PC with Intel Core i7-740QM Processor Windows 7 Home Premium,Wall Mount Bracket for Flat Panel LCD Plasma TV Steel 27x11-1 2x4 Silver,064654U,,Lenovo,Balt,998.0,118.08
899,587,TP-Link TL-SC3171G Wireless Day Night Surveillance Camera,Cobra MicroTalk CXR700 25-Mile 22-Channel FRS GRMS Twp-Way Radio Pair,TL-SC3171G,CXR700,TP Link,Cobra,172.0,65.63
244,17129,OCZ Technology Vertex 2 90GB 2.5  SATA II Solid State Drive,New-Geographics 45332 - Certificate Document Cover 12-1 2 x 9-3 4 Navy Blue 6 Pack - GEO45332,OCZSSD22VTXE90G,,OCZ Technologies,Geographics,179.98,
2483,16779,3M Porcelain Marker Board Steel Backed 6 x4 Aluminum,Stanley Bostitch SB35PHD5M - Personal Heavy-Duty Staples 5 000 Box,,,3M,Stanley,462.79,
2020,7685,HON Metal Bookcase 34-1 2w x 12-5 8d x 81-1 8h,High Power Concord Designer Manual Screen - 100 diagonal AV Format Size 84 diagonal,S82ABCP,,HON,Da-Lite,369.0,
2017,6836,Asus Blue 10.1  1015B-MU17-BU Netbook PC with AMD C30 Processor and Windows 7 Starter,Kicker 09EB101G Noise Isolation In-Ear Headphones Green,1015B-MU17-BU,09EB101G,Asus,Kicker,278.0,27.12
1201,11307,Verbatim 95003 3x DVD-RAM Double-Sided Media,Uniden Digital Mobile Scanner with 25 000 Channels and GPS Support BCD996XT,95003,BCD996XT,Verbatim,Uniden,13.88,462.14
1295,12726,Avery Shipping Labels with TrueBlock Technology 8-1 2 x 11 White 25 Pack,Boston Celtics iPhone 3G Duo Case,8165,,Avery,Tribeca,11.94,9.99
104,18490,Vizio 42  Class 1080p 120Hz LCD HDTV RBE421VA Refurbished,Dixon 13960 - Ticonderoga Breast Cancer Awareness Woodcase Pencil HB 2 Pink Barrel Dozen,RBE421VA,,Vizio,Dixon,479.0,
920,21895,Rubbermaid 3-Hole Punched Plastic Edge Strip Magazine Holders for Ring Binders 12ct,2.4GHz Digital Video Sender,,,Rubbermaid,RF Link,5.94,142.49
1728,22031,HP TouchPad - Touchstone Charging Dock Stand,White Replicase Hard Crystal Air Jacket Case AT T iPhone 4 4G 16GB 32GB not for Verizon,,,HP,Cimo,35.0,4.0
583,15367,iHome Wireless Optical Mouse Black,A7 Ipad Slip Case,IH-M821WB,TSS17802US,iHome,Targus,25.56,21.32
1514,12839,snapSHIELD P2 Polycarbonate Case iPad 2 Smoke,LaCie CurrenKey 8 GB USB 2.0 Flash Drive 130826 Silver,IPD2PCBK,130826,Scosche,LaCie,20.88,29.99
362,14534,Five Star 3-subject College Rule Notebook 2 pack,Canon EOS 60D 18 MP CMOS Digital SLR Camera with 3.0-Inch LCD Body Only,,60D Body,,Canon,9.24,978.0
2411,20766,Sanus 13 Full Mount in Black 13 - 27 Screens,Woodees IESW200B Sport Earphones with Microphone,,IESW200B,Sanus,Woodees,66.99,49.99
523,18076,Veho VCCA002WPC Waterproof Case for Muvi MuviTurin,New-House of Doolittle 6653 - 60-Day Wall Planner Laminated 32 x 21 1 2 Blue White Yellow Silver - HOD6653,VCCA002WPC,,VEHO,House of Doolittle,29.98,
1654,20302,Sabrent 32 USB 2.0 Active Extension Cable,Precision Design 0.25X Super AF Fisheye Lens with 3 Piece UV FLD CPL Filter Set Cleaning Accessory Kit for Canon EOS Rebel XS T1i T2i T3  T3i Digital SLR Cameras with 18-55mm 75-300mm III or 55-250mm IS Zoom Lens,CB-USBXT,K-61579-13,Sabrent,Precision Design,13.88,49.95
2412,16449,iHome 2-in-1 Portable Speakers with built-in Headphones - Purple,Chartpak DEC001 - Deco Bright Decorative Tape 1 8 x 324 Red Black Blue Green Yellow 6 Box,,,iHome,Chartpak,94.88,
839,12706,Motorola Dect 6.0 Cordless Care,Dee Messenger Green 14IN-16.4IN Youthful Design No Limits Warr,K301,N25878P,Motorola,Dicota,30.84,32.88
198,17276,Draper Matte White Rolleramic Electric Screen - AV Format 15 x 20,New-Smead 34276 - Heavy W-fold Expansion Folders Two Fasteners End Tab Letter Manila 50 Box - SMD34276,115020,,Draper,Smead,2989.99,89.0
1980,20201,Iomega 1TB Ego Desktop USB 2.0 Portable Hard Drive - Midnight Blue,Tripp Lite P560-006 DVI Dual Link TDMS Cable - DVI-D M M - 6ft,34837,P560-006,Iomega,Tripp Lite,89.98,10.88
675,14674,3m Easy Trap 8 x 125 Duster,Logitech Corded Mouse M125 Blue,55654,910-001831,3M,Logitech,74.97,11.48
534,20681,Grip 43108 30 Piece Heat Shrink Tube Set,New-Ethernet to VGA over IP - IPUSB2VGA,43108,,Grip,StarTech,4.99,180.0
709,19988,Green Onions Supply iVeil Hybrid Keyboard Protector,HP g6-1a60us Notebook PC - Blue,RT-KBHB06,g6-1a60us,Green Onions Supply,HP,31.88,429.0
1598,10732,Everstart 14-Gauge 20 Black Primary Wire,Logitech Wireless Anywhere Mouse MX for PC and Mac,51653-76-08,910-001637,Generic,Logitech,0.0,44.99
2168,11436,LifeWorks Netbook Cooling Pad Mouse Kit IHB931NR,StarTech.com PCI Express to PCI Riser Card x1 for Intel 1U IPC Server PEX1PCI1R,IHB931NR,PEX1PCI1R,LIFEWORKS,StarTech,49.88,46.34
2308,17458,Kimberly-Clark Professional Surpass 100 Percent  Recycled Fiber Two-Ply Facial Tissue 125 sheets 60 ct,New-Bush WC72446 - Series C Bow Front Desk 71w x 36-1 8d x 29-7 8h Natural Cherry - BSHWC72446,21285,,KIMBERLY-CLARK PROFESSIONAL,Bush,86.97,507.0
1300,6638,Sony H Series NP-FH50 Actiforce InfoLithium Battery Hybrid,Motorola MOTOROKR EQ3 Compact Folding Speaker,NPFH50,89244,Sony,Motorola,38.0,19.99
778,20821,Acer Black Veriton PS.VAL03.052 Desktop PC with Intel Dual-Core E7600 Processor 320GB Hard Drive and Windows 7 Professional Monitor Not Included,PS667AS - Ambir PS667 Simplex A6 ID Card Scanner 48 bit Color - 24 bit Grayscale - 600 dpi Optical,PS.VAL03.052,,Acer,Ambir Technology,499.0,44.39
525,8657,Disney Fairies Notebook,NETGEAR DGND3300 RangeMax Dual Band Wireless-N Router with Built-in DSL Modem,,DGND3300-100NAS,Disney,Netgear,0.0,
2125,1040,Seagate Barracuda 500GB Internal Hard Drive,HP Laserjet 642A Yellow Cartridge in Retail Packaging CB402A,ST3500413AS,CB402A,Seagate,HP,44.99,207.96
448,15641,Ematic Articulating Wall Mount Kit for 15  TV Includes 6FT HDMI Cable Cleaning Solution Cleaning Cloth EMW3202,POLAROID PBT303BLK Bluetooth Headset Black,EMW3202,PBT303BLK,Ematic,Polaroid,29.99,17.19
979,306,Sharpie Permanent Markers Fine Point - Black - 12 Count,Panter Company MAGLHBK - Slap-Stick Magnetic Label Holders Side Load 4-1 4 x 2-1 2 Black 10 Pack,30001WM,,Sharpie,Panter Company,8.24,
2205,6234,Draper Glass Beaded Targa Electric Screen  - AV Format 96 x 96,Black 2-Port USB Home Travel Charger for Apple iPhone 1st 2nd 3G 3rd 3Gs Ipod Touch 1st Touch 2G Ipod Nano,116034,,Draper,GTMax,670.6,0.11
1052,8631,BIC Triumph 537 0.5mm Needle Point Roller Pen Black 4 Ct. 2-Pack,Cables Unlimited 48 Port Cat6 Feed Thru Patch Panel with inLine Couplers 19 in Black,,UTP-9148,,Cables Unlimited,7.76,479.99
1254,13764,Scotch Weighted Desktop Tape Dispenser,Nikon Coolpix P500 12.1 MP Digital Camera Black with 8GB Card  2 Batteries Case Tripod Cleaning Kit,C38BK,K-58527-03,Scotch,Nikon,7.9,409.95
1872,12061,iHome LifeTalks Foldable USB Headset - Blue,Vantec NexStar SE Dual 2.5-Inch SATA Hard Drive Rack MRK-525ST Black,IH-H413UN,MRK-525ST,iHome,Vantec,29.84,13.57
2101,19843,Imation 26654 Swivel 8GB USB2.0  Flash Drive,SLIDES 2 PC Scanner,26654,,Imation,ION Audio,25.84,99.95
1196,21101,Targus 17  Platinum Blacktop Standard Laptop Computer Case Black Gray,Us Postal Scales United States Postal Scales Plus20 Ps200 United States Postal Scales 020 Lb Capacity Light Gray Finish  Computer-Other Postal Scales,CPT301US,,Targus,US POSTAL SCALES,46.88,70.4
1541,11852,Acer Black VX275-UD7601W Desktop PC with Intel Core 2 Duo E7600 Processor 320GB Hard Drive and Windows 7 Professional Monitor Not Included,Jawbone ICON-Series Hero Bluetooth Headset Black,PS.VAM03.033,JBG03BD,Acer,Jawbone,498.0,
946,20301,HP 90 Ink Cyan C5061A,Sentry Micro-Buds Digital Stereo Earphones With Pouch Pink - Sentry HO543,C5061A,,HP,Sentry,204.75,4.55
2299,10937,Kodak Adventure Camera   Camcorder Accessory Kit includes Grippable Tripod Hard Case Neck Strap 4GB Memory Card compatible with PlaySport and other cameras.,I Concepts 15688-Ip Cassette Adapter,1913300,15688-IP,Kodak,Sakar,29.0,
2185,20314,Three Position PowerMat with Powercube,New-Avery 5429 - Erasable ID Labels 7 8 x 2-7 8 White 80 Pack - AVE5429,PMM-3P-B1,,Powermat,Avery,79.54,5.88
1481,13456,Fellowes Split Design Keyboard w Microban Protection,Sony Micro Vault N-Series Click 16 GB USB 2.0 Flash Drive USM16GN,98915,USM16GN,Fellowes,Sony,40.84,20.16
871,3994,HP CB40 Toner 7500 Page-Yield,AC Adapter Power Supply Charger Cord for Gateway MT6729 E-475M 3000 MX3210 MX3225 MX3417 MX6124 MX6423 MX6433 MX6920 MX6959 m-6750,CB400A,,HP,SIB,249.23,0.66
2502,20994,3M Laptop LCD Privacy Computer Filter PF14.0W,Luxe Case for iPad Teal Black,PF14.0W,IPAD-LUX-TEA/BLK,3M,iFrogz,44.57,24.99
331,15443,Scosche Increased Dynamic Range Chameleon Earphones IDR355MD,Sony HDR-XR550V 240GB High Definition HDD Handycam Camcorder,IDR355MD,HDR-XR550V,Scosche,Sony,24.34,1299.95
2045,21564,jWIN Bluetooth Keyboard for iPad iPhone,Marware Eco-Vue for iPad 2 Black 602956008538,IBTKB20BLK,602956008538,JWin,Marware,63.88,25.08
1010,21895,Buffalo Technology MediaStation 6x Blu-ray Writer,2.4GHz Digital Video Sender,BRPX68U2BK,,Buffalo Technology,RF Link,164.82,142.49
2135,15376,EDGE 4GB 2X2GB PC25300 NONECC UNBUFFERED 200PIN DDR2 SODIMM,Targus Deluxe Zierra Case and Stylus Bundle for Apple iPad BUS0250 Black,PE20823302,BUS0250,EDGE,Targus,69.82,62.46
2507,2177,Dixie Sage 8-1 2 Inch Paper Plates 125ct,Boss ROCKER 3-Way Waketower Speaker System with 8 Midbass 6 Midrange and 1 Tweeter,SXP9SCDX,ROCKER,Dixie,BOSS,21.97,656.14
325,14813,CORSAIR XMS2 2GB 2 X 1GB PC2-6400 800MHz 240-pin DDR2 CL5 Dual Channel Desktop Memory Kit - TWIN2X4096-6400C5C,JBL On Stage Micro Portable Speaker Dock for iPod Black,TWIN2X4096-6400C5C,JBLONSTMBLK2P,Corsair,JBL,72.82,54.37
472,20825,Hello Kitty Super Karaoke with Camera,PIONEER CNSD-110FM Map Update for PIOAVICZ110BT Navigation A V Receiver,68109,CNSD-110FM,Sakar,Pioneer,103.35,62.22
2450,15506,StarTech.com DVIDSMM15 15ft DVI-D Digital Video Cable,Seagate Barracuda 500 GB 7200RPM SATA NCQ 16 MB Cache 3.5-Inch Internal Desktop Hard Drive ST3500641AS-RK-Retail Kit,DVIDSMM15,ST3500641AS-RK,StarTech,Seagate,19.88,54.99
243,9758,Post-it Notes Original Notes Canary Yellow,Philips DCM278 37 Micro Hi-Fi System Dock with CD for iPod iPhone,659YW,DCM278/37,POST-IT,Philips,45.0,81.57
527,5633,Sage Peachtree Pro Accounting with Payroll 2012 PC,RCA ANT1600R Flat Digital Passive Indoor TV Antenna,PRO2012PRRT,ANT1600R,Sage,RCA,318.0,31.38
2150,13741,Kodak EasyShare M552 Dark Pink 14MP Digital Camera w 5x Optical Zoom 2.7  LCD Display w 50 Bonus Prints,Olympus UFL 1 Ultralight Bracket Bundle - Underwater flash - 14 m,M552Pink,1 Ultralight Bracket Bundle,Kodak,Olympus,94.54,314.0
2537,9266,Gator Cases ATA Molded Utility Case 11.7 x 16.7 x 5.9,VTech CS6209 DECT 6.0 Accessory Handset for use with models CS6219 CS6229,GXDF-1116-5-TSA,CS6209,Gator Cases,VTech,139.99,
919,8408,Coby 7  LCD Dual Screen Tablet Portable DVD Player,Aluratek eSATA USB 2.0 2.5-Inch 3.5-Inch SATA Portable External Hard Drive Docking Enclosure Hub AHDDS100F,TFDVD7752,AHDDS100F,Coby,Aluratek,139.29,34.84
1483,14864,Cobra Mobile CB Radio With NightWatch Illuminated Display And SWR Antenna Calibration,iLuv iCC822 Hard Smart Back Cover Case for 2nd Generation Apple iPad 2 WiFi 3G Model 16GB 32GB 64GB NEWEST Model Tan,29-WXNWST,iCC822TAN,COBRA,iLuv,150.0,18.23
2394,18089,Adobe Acrobat X Standard Upgrade from Acrobat Standard 7 8 9 Windows,New-find It FT07046 - Findit File Folders 1 3 Cut 11 Point Stock Letter Manila 80 Pack - IDEFT07046,65096933,,Adobe,find It,139.18,28.0
783,19851,Swingline Optima PowerEase Stapler Graphite,ILUV ICC617CLR IPOD TOUCH 4G PC CLEAR CASE,87850,,Swingline,iLuv,23.94,
1138,17285,Cooler Master Hyper TX 3 with Intel AMD support,New-Scanjet 1000 Professional Mobile Scanner - CM8204,RR-910-HTX3-G1,,Coolermaster,HP,19.99,359.55
75,2173,Cables To Go Digital Audio Explorer Toslink Selector Switch,rooCASE Dual Station Premium Leather Pink Case Cover with Stand for Apple iPad 2 Wifi 3G Model 16GB 32GB 64GB,28734,,Cables To Go,rooCASE,24.88,29.92
2226,3734,Targus 13.3  Widescreen LCD Monitor Privacy Screen,Patriot Signature 4 GB PC2-6400 DDR2 Notebook Memory PSD24G8002S,ASF133W9USZ,PSD24G8002S,Targus,Patriot,42.07,56.99
732,7877,Draper AT1200 Targa Acoustically Transparent Screen - 132 diagonal Widescreen Format,HP g6-1a69us Notebook PC - Black,116114,g6-1a69us,Draper,HP,3702.95,529.95
1603,1924,Buddy Products Dr. Pocket Steel 3-Pocket Wall File Black,Flip Video Action Tripod,52104,AAT1B,Buddy Products,Flip Video,51.94,7.11
2361,11743,Wilson Jones Visitor Register Book Red Hardcover 112 Pages,Peerless LCD Pedestal Stand for 10 to 30 Flat Panel Screens,S490,LCFS 100S,Wilson Jones,Peerless,41.94,186.19
2291,7236,Orbital Tilt and Turn TV Wall Mount with Glass Shelving for 25-40  TVs,WR-B100 Wireless Remote Control for Nikon D700 D300 D300S D200 D3 D2H D2Hs D2x D1 D1H D1x F100 F6 F5 F90X and F90 fully compatible with Nikon MC-30,RESL422B-E,WR-100B Wireless Remote Control Shutter,Orbital,Satechi,0.0,49.99
1226,17207,Vantec NexStar 2.5  SATA to USB 2.0 Hard Drive Dock,Top Tab File Folders Double Ply Top 1 3 Cut Letter White 100 Box SMD12834,NST-D100S2,,Vantec,Smead,24.2,
246,7415,VIZIO 47  Ultra-Slim M470VT,Switcheasy RunAway Nike Plus iPod AnyShoe Adapter Black,M470VT,100-RA-002-B,Vizio,SwitchEasy,799.0,8.83
821,9131,Asus ENGT430 DC GeForce GT430 1GB DDR3 Graphics Card,Fantom MDE1000 G-Force Megadisk 1 TB USB 2.0 eSATA,ENGT430 DC S/DI/1GD3,MDE1000,Asus,Micronet,84.88,170.79
2468,7870,US Brown Bear Full Motion Series Medium Dual Arm Mount for 23 - 37 Displays in Silver,HQRP 90W AC Adapter for Dell Inspiron 9200 9300 9400 e1405 e1505 Family Replacement Charger Power Supply Cord plus HQRP Coaster,,,US Brown Bear,HQRP,59.99,27.95
394,12401,Ergotron 47-092-800 100 Series Wall Mount Single Pivot - 25 lb - Gray,ACP-EP 4 GB DDR3 SDRAM Memory Module - 4 GB - 1066MHz DDR3-1066 PC3-8500 - DDR3 SDRAM - 204-pin SoDIMM AA1066D3S7 4G,47-092-800,AA1066D3S7/4G,Ergotron,ACP-EP Memory,44.84,39.18
2408,19960,Avery Postcards for Laser Printers 4 White Uncoated Box of 100.,Pineapple PEHTIGERWT Tiger Earphones,5389,,Avery,Pineapple,19.84,21.6
308,10460,NEC 22  LCD Monitor Black EA221WM-BK,Dell Inspiron Duo Audio Station,EA221WM-BK,,NEC,DELL,249.0,52.55
2415,5279,TRENDnet TU2-700 7-Port High Speed USB Hub w Power Adapter,Uniden GMR2238-2CK 22-Mile GMRS Water Resistant Two-Way Radio Blue,TU2-700,GMR2238-2CK,TRENDnet,Uniden,26.05,33.24
623,18729,Innovera Desktop Copyholder Monitor Mount Black,Incipio 1-Port Wall Charger for iPod iPhone and iPad IP-642,59001,IP-642,INNOVERA,Incipio,9.0,23.75
1866,18983,GE 3-Way Rocker Switch,New-ATREND 10SME B BOX SERIES SINGLE SHALLOW MOUNT SEALED ENCLOSURE 10 - ATR10SME,18238,,General Electric,ATREND,0.0,50.0
1782,11780,Dell 15 Standard Yield Black Cartridge,Oxford 40591 - Reinforced Board Card File with Lift-Off Lid Holds 1200 6 x 9 Cards Black White,Series 15 Black,,Dell,Oxford,18.97,
1092,9157,HON 600 Series Two-Drawer Lateral File Black,Ematic EA103 Universal eBook Reader Accessory Kit,682LP,EA103,HON,Ematic,449.94,11.41
1190,21378,Marware C.E.O. Hybrid iPad 2 Case Black,Pioneer TS-G1342R 5.25-Inch 2-Way 140-Watt Speaker,602956007722,TSG1342R,Marware,Pioneer,39.99,27.99
1045,22019,iFrogz iPod Touch 4 Luxe Original Case Blue Black,BlueAnt T1 Rugged Bluetooth Headset,IT4LO-BLU/BLK,USEN-BAW-T1,iFrogz,BlueAnt,29.99,52.95
1413,11373,Post-it Notes Dispenser w Weighted Base Plastic 11 7 8 x 2 1 2 x 7 3 4 Gray,Epson Erc Ribbon Cassette for TMU200D TM300A TM300B Black,C50,ERC-38B,POST-IT,Epson,22.94,2.3
161,997,imation 3.5  Diskettes IBM-Formatted DS HD,iLive iB209 Portable Speaker System for iPod with AM FM Radio Black,15847,IB209,Imation,iLive,39.09,44.84
1579,16107,V7 3-Button Optical Mouse USB,Pioneer TS-A878 3 1 2 Inch 2-Way Speakers,M30P10-7N,TS-A878,V7,Pioneer,7.82,
247,8570,iLuv iPod nano 6G Clear Type Protective Film,Cmple - 25 ft Component Video Audio Cable 5-RCA HDTV Gold 25ft,ICC1112CLR,,iLuv,Cmple,11.88,10.05
875,112,Quantum MR-S4MQN-01 DLTtape S4 Cartridge,MMF Industries 201300006 - Slotted Rack Key Tags Plastic 1-1 2 x 1-1 2 White 20 Pack,MR-S4MQN-01,,Quantum,MMF,97.88,
940,1812,Sabrent USB 2.0 FireWire PCMCIA Cardbus,Opteka SW-1 Sidewinder Joystick Pistol Grip Ball Head with Quick Release Plate for Tripods Monopods,SBT-PCA4,SW-1,Sabrent,Opteka,14.88,29.0
97,4074,RCA 42  Class LCD 1080p 60Hz HDTV 42LA45RQ,TDK Systems LTO ULTRIUM 2 200 400GB-TAPE CART D2405-LTO2AX,42LA45RQ,D2405-LTO2AX,RCA,TDK,429.0,30.8
231,15841,StarTech.com SLSATAF20 20in Slimline SATA Male to SATA Cable,Epson S041637 19inx13in 260Gsm Velvet Fine Art Paper,SLSATAF20,S041637,StarTech,Epson,9.88,44.49
896,941,Diaper Dude Black Coated Grey Digi Laptop Sleeve 13,Joby BH2-01EN Ballhead X for Joby Focus Flexible Tripod,207492,Ballhead X,Diaper Dude,Joby,32.0,
891,16192,Q-See QC444-411-5 4-Channel Video Surveillance System,deflect-o 590401 - Slanted Desk Sign Holder Plastic 4 x 6 Clear,QC444-411-5,,Q-See,Deflect-O,299.82,
1124,18618,Platt Blow Molded Case in Black 37x 10.5 x 3.75,Cincinnati Bengals iPod Touch 4G Hard Case,208,,Platt,Tribeca,19.99,29.99
1522,8680,StarTech.com PCISCSIUW 1 Port PCI Ultra Wide SCSI Controller Adapter Card,Motorola Protective Gel Case for MOTOROLA XOOM Blue Motorola Retail Packaging,PCISCSIUW,89479N,StarTech,Motorola,75.88,8.03
1906,20427,OCZ Technology 110GB RevoDrive PCI Express Solid State Drive,Mach Speed Cartunes Max FM Transmitter,OCZSSDPX1RVD110,MP3-CARTUNES MAX,OCZ Technologies,Mach Speed,429.99,21.99
867,12469,GE RCA Extension Adapter 2pk,Dell SWITCH by Design Studio Lid for Inspiron R Series Laptop - Sangeet,32630,"SWITCH by Design Studio,Sangeet - 15""",General Electric,Dell,0.0,49.99
439,7192,SIIG SoundWave 7.1 Channel PCI Sound Card,Kodak Fashion Jewelry Neck and Wrist Strap - Digital camera accessory kit,IC-710012-S2,,SIIG,Kodak,34.84,9.99
2381,9938,Aleratec Inc DVD CD Robo Racer Duplex,Black Yellow Leopard Print Executive Leather Portfolio Case Cover with Elastic Zebra Print Hand Strap for Samsung Galaxy Tab P1000 7-inch Wireless Tablet Compatible with Sprint US. Cellular Verizon AT T T-Mobile  Screen Protector Black USB Car Charger SumacLife TM Wisdom Courage Wristband,280113,,Aleratec,Bestpriceshop,912.99,34.99
1023,3541,SIIG 2.5  SATA SuperSpeed USB 3.0 Hard Drive Enclosure,Sima SVS-14 4 Input Manual A V Selector,JU-SA0912-S1,SVS-14,SIIG,Sima,20.39,18.99
1886,14144,Avery 600pk High-Visibility Round Laser Labels White,OCZ Technology 100 GB RevoDrive X2 Series PCI-Express x4 Solid State Drive SSD OCZSSDPX-1RVDX0100,5293,OCZSSDPX-1RVDX0100,Avery,OCZ,12.54,359.99
179,20278,JVC FLATS Lightweight Folding Headphones Silver,Cinepal Personal Media Player 8IN HD 720P Videos Photos MP3,HAS160S,APMP101F,JVC,Aluratek,36.88,99.99
401,19251,Draper M1300 Signature Series V Electric Screen  - NTSC 200 diagonal,New-Quartet MP1350Q - Class Three Executive Metal Laser Pointer Projects 500 Yards Matte Silver - QRTMP1350Q,100459,,Draper,Quartet,4115.5,28.58
2279,18389,Compucessory Compucessory AA USB Extension Cable Black,New-EXPO 83056 - Dry Erase Marker Organizer Chisel Tip Assorted 6 Set - SAN83056,,,Compucessory,Expo,11.59,
2347,20571,MAXSA Motion-Activated Dual-Head LED Security Floodlight,Chief RPA Elite Series RPMB091 - Mounting component mount interface bracket for projector - black,40218,RPMB091,Maxsa,Chief,44.84,183.2
1782,5754,Dell 15 Standard Yield Black Cartridge,Opteka SB-1 Mini Universal Studio Soft Box Flash Diffuser for Canon EOS Nikon Olympus Pentax Sony Sigma  Other External Flash Units,Series 15 Black,UV-S-DIF,Dell,Opteka,18.97,9.94
1533,15827,Da-Lite High Power Model B Manual Screen with CSR - 60 x 80 Video Format,Globe 7732001 Home Appliance Six-Outlet Swivel Surge Tap,85319,7732001,Da-Lite,Globe Electric,369.99,12.6
142,299,Cables Unlimited - 1 Port DB9 Serial Neos 9820 Chipset PCI I O Card,New-Bankers Box 1231201 - Super Stor Drawer Steel Plus Storage Box Legal Kraft Green 6 Carton - FEL1231201,IOC-2000,,Cables Unlimited,Bankers Box,20.88,284.0
2106,13657,Coby Purple High-Performance Isolation Stereo Earphones CVEM79PUR,Hi-Capacity SONY Clie PEG-TG50 PDA Equivalent Main Battery,CVEM79PUR,B-8617-AZ156673,Coby,Battery-Biz,8.54,29.99
19,9123,Innovera CD DVD Pocket with Built-In Label Tab Clear 25 Pack,Fellowes Self-Adhesive Letter Laminating Pouches 5 Pack 52205,39701,52205,INNOVERA,Fellowes,5.28,7.23
1342,14907,Stanley MaxSteel Tape Rules - 5 8 x12 c.g. power meas,HTC EVO 3D 4G Android Phone Sprint,680-33-691,EVO 3D,Stanley,HTC,17.99,
1464,2509,US Brown Bear Large Tilt Low to Profile Mount for 32 to 63 Displays in Silver,Crosley Coloradio CR52 - Radio cassette player - black,,CR52,US Brown Bear,Crosley,59.0,49.65
1012,16611,Startech SuperSpeed USB 3.0 SATA Adapter Cable for 2.5in or 3.5in Hard Drives USB3S2SATA,Jabra GN Netcom 2000 Series USB Mono CIPC Noise Canceling Headset with Boom Microphone,USB3S2SATA,,StarTech,GN Netcom,49.0,91.41
458,7986,Asus Black 10.1  Eee Seashell 1015PX-PU17-BK Netbook PC with Intel Atom Dual-Core N570 Processor and Windows 7 Starter,Bridge 42x24x29-1 2 Medium Oak,1015PX-PU17-BK,,Asus,Hon,338.0,134.53
1152,3500,Quality Park Antistatic Fiberboard Disk Mailer White Recycled 25 Box,Sony FAEC1AM Extension Cable for Sony Alpha Digital SLR Camera Flashes,64126,FAEC1AM,,Sony,16.97,44.61
2184,8222,HP C8560A Drum Unit,Metra 95-6511 Chrysler Jeep DDIN 2007 Dash Kit,C8563A,95-6511,HP,Metra,671.69,11.19
351,17338,Acer Black 17.3  AS7551-7422 Laptop PC with AMD Phenom II X4 Quad-Core N970 Processor and Windows 7 Home Premium,New-Iceberg 94103 - Aspira Workstation Square Corner Connector Resin Platinum 28w x 28d x 30h - ICE94103,AS7551-7422,,Acer,Iceberg,478.0,370.0
1647,13304,HON 38000 Series Rght Pedestal Desk,Vanguard VGP-13 Mid-Size Photo Video Hard Case,38293RQQ,VGP-13,HON,Vanguard,899.0,62.13
2534,1356,Draper IRUS Rear Projection Screen with System 100 Black Frame - 92 diagonal NTSC Format,Ultra-Slim Articulating Wall Arm for 37 to 55 Ultra-Thin Screens Only Weighing Up to 100 lb,125106,SUA750PU,Draper,Peerless,4196.7,
459,13675,V7 25 CAT5e Snagless Network Patch Cable Yellow,Planar PT1510MX - LCD display - TFT - 15 - 997-3198-00,V7N3C5E-25F-YLWS,,V7,Planar Systems,6.88,429.0
1466,21760,Kodak EasyShare C195 Red 14.0MP Digital Camera w Bonus Case Bundle 5x Optical Zoom 3.0  LCD Smart Capture w 50 Bonus Prints,Noah Company W9868BK USB Backlit Blue LED Multimedia Keyboard Piano Black,C195 Red Bndle,W9868BK,Kodak,by Noah Company,79.0,24.81
870,5931,Sylvania SDVD7027 7  Portable DVD Player Black,Case Logic CDW-320 320 Capacity Nylon CD Wallet Black,SDVD7027-BLACK,CDW-320,Sylvania,Case Logic,59.0,28.99
948,5964,StarTech.com DVIVGAFM DVI to VGA Cable Adapter - F M,Avery Laser Rotary Cards 2 1 6in. x 4in. Box Of 400 Cards,DVIVGAFM,5385,StarTech,Avery,9.88,15.73
547,10104,Microsoft Sidewinder X6 Keyboard,Nuo Tech Vertical Canvas Messenger Bag-Color Khaki,,100064,Microsoft,Navarre,59.82,53.99
719,2526,Motorola Thrill Me Purple EH25 Stereo Headset,Cooler Master USNA 95 Ultra Slim 95W Universal Notebook Adapter with USB 2.0 RP095-USNAA1-US,89273N,RP095-USNAA1-US,Motorola,Cooler Master,24.88,53.99
2526,6550,Genius Agama M-300 Retractable Mini Mouse - Optical - USB - Black,Canon PowerShot ELPH 300 HS 12.1 MP Digital Camera Black,31010615100,ELPH 300 HS - BK,Genius,Canon,10.0,229.0
1358,20212,Micro Innovations 4230300 EasyGlide Travel Wired Optical Mouse,StarTech.com PS23N1THIN6 6 Feet 3-in-1 Universal Ultra Thin PS 2 KVM Cable,4230300,PS23N1THIN6,Digital Innovations,StarTech,10.88,12.99
2042,9252,Draper Glass Beaded Rolleramic Electric Screen - AV Format 8 x 10,Western Digital Velociraptor 600 GB SATA III 10000 RPM 32 MB Cache Bulk OEM 3.5 Inch Desktop Hard Drive - WD6000HLHX,115041,WD6000HLHX,Draper,Western Digital,1551.95,249.99
1847,20736,Canon PSC-4100 Deluxe Soft Case compatible with SX-30 Canon Camera,NEW ILUV IAD562BLK USB DC ADAPTER IPHONE R SYNC CABLE PERSONAL AUDIO,PSC-4100,,Canon,iLuv,22.99,35.5
562,8333,Da-Lite Da-Plex Self Trimming Rear Projection Screen - 96 x 120 AV Format,Avery Mini-Sheets Laser Ink Jet Labels 1.33 x 4 Inches White 150 per Pack 2162,27903,02162,Da-Lite,Avery,7799.99,3.78
844,7640,3M Monitor Stand for CRT   LCD,Roku XDS Streaming Player 1080p,MS80B,2100X,3M,Roku,39.88,98.0
2124,11930,Panasonic Lumix DMC-TS3S Silver 12.1MP Digital Camera w 4.6x Optical Zoom 2.7  LCD HD Movie Recording,GBC CombBind Binding Spines 2-Inch Spine Diameter Black 425 Sheet Capacity 50 Spines 4200022,Panasonic DMC-TS3S,4200022,Panasonic,Quartet,333.54,24.23
1201,8163,Verbatim 95003 3x DVD-RAM Double-Sided Media,Professional Kingston MicroSDHC 4GB 4 Gigabyte Card for Pantech Link with custom formatting and Standard SD Adapter. SDHC Class 4 Certified,95003,,Verbatim,Kingston,13.88,7.62
