ID_A,ID_B,Title_A,Title_B,Model_Number_A,Model_Number_B,Brand_A,Brand_B,Price_A,Price_B
993,6771,HP 61 Black   Tri-color Combo Inkjet Cartridge,Lexar LJDFF16GASBNA JumpDrive FireFly 16 GB USB 2.0 FlashDrive Red,HP 61,LJDFF16GASBNA,HP,Lexar,30.5,21.95
1989,17393,Stanley Bostitch 00540 AntiJam Extra Heavy-Duty Stapler 215-Sheet Capacity Black,New-Quality Park 67539 - Reveal-N-Seal Double Window Check Envelope Self-Adhesive White 500 Box - QUA67539,540,,Stanley Bostitch,Quality Park,65.0,98.26
1205,21357,Draper Matte White Paragon Electric Screen - AV Format 19 6 x 26,TRENDnet 300 Mbps Wireless Easy-N-Upgrader TEW-637AP,114099,TEW-637AP,Draper,TRENDnet,10682.45,39.99
106,20197,Koss Stereophones With Flexible Headband Design,Wow Pen Joy Vertical Ergonomic Optical Mouse Silver By Ergoguys,SPORTA-PRO,WP-012-S-E,Koss,ACP,29.88,30.34
685,11819,Weyerhaeuser Company MultiUse Premium Paper 98 Brightness 24lb 8-1 2 x 14 White 500 Sheets Ream,Nokia Travel Charger N91 N90 N80 7370 6282 6265i 6165i 6155i 6126 6103 6102i 6102 6101 3155i Travel Charger Compare to Nokia AC-3U,85781,,,Nokia,12.47,2.98
385,14689,ASUS ET1611PUT-B001E 15.6  Windows 7 Home Premium,Da-Lite Perm-Wall - Projection screen - 100 in 254 cm - 4 3 - High Contrast Da-Mat,ET1611PUT-B001E,,Asus,Da-Lite,468.0,
1151,10092,Webster s Spelling Corrector Plus NCS101,Toshiba NB505-N508BN 10.1-Inch Netbook Brown,NCS101,PLL50U-01900C,Franklin,Toshiba,16.82,264.76
2518,1848,Logitech Wireless Mouse M315 Victorian,StarTech.com 1-Port RS232 Serial over IP Ethernet Device Server NETRS232 1,910002534,NETRS232_1,Logitech,StarTech,19.88,117.99
501,20369,Cobra HighGear Noise-Canceling External Speaker,ClearOne Chat 160 - USB VoIP desktop hands-free,HG-S300,910-156-251-00,COBRA,ClearOne,17.03,326.49
1789,8297,Plantronics VistaPlus Audio Processor,Belkin FastCAT Premium Snagless - Patch cable - RJ-45 M - RJ-45 M - 25 ft - UTP - CAT 5e - snagless - blue,AP15,Premium Snagless,Plantronics,Belkin,141.31,
1580,3251,Sony SS-CR3000 Home Theater Speaker Completer Package,XANTECH CPL10 RF IR Coupler,SS-CR3000,CPL10,Sony,Xantech,99.99,12.0
517,18461,RCA 32  Class LCD 720p 60Hz HDTV 32LA30RQ RCA Home Theater System with 6ft HDMI Cable Bundle,Horizontal Cable Distribution for Open Wall Mount Racks,,,,Middle Atlantic,379.0,435.99
1402,1208,Xerox Card Scanner 200 Scanner,EDGE - Memory - 1 GB - DIMM 184-pin - DDR - 333 MHz PC2700 - CL2.5 - unbuffered - ECC,Xerox Card Scanner 200,PEIBM06P4055-PE,XEROX,Edge,168.98,58.18
2395,2013,Western Digital 750GB My Passport Essential SE USB 3.0 Silver Portable Hard Drive,Samsung 12.2MP Dig Camera 4.6X Wide Ang Opt Zm Purple,WDBACX7500ASL-NESN,EC-TL225ZBPLUS,Western Digital,Samsung,96.98,
404,13452,Draper DiamondScreen Rear Projection Screen with No Frame - 96 diagonal NTSC Format,Reader Pocket-silver,127105,PRS-300SC,Draper,Sony,6797.5,105.99
980,12155,Simplism Protector Film for iPad,Q-See QSSIGD2 Decoy Cameras and Warning Sign 2 Pack,TRPFSIPADAGEN,QSSIGD2,Simplism,Q-See,23.41,29.99
344,16613,Everstart 14-Gauge 20 Red Primary Wire,Translucent Multicolor Write-On Dividers Eight,51653-76-04,,Generic,Avery,0.0,
1269,9439,Disney Toy Story CD Boom Box,Targus 13.3-Inch Notebook Privacy Filter ASF133WUSZ,TS500B,ASF133WUSZ,Disney,Targus,39.54,36.99
2244,4810,Brother TX2411 P-Touch TX Laminated Tape,Kingston Datatraveler 160 - 32 GB USB 2.0 Flash Drive DT160 32GB,TX2411,DT160/32GB,Brother,Kingston,34.88,52.9
2181,13604,Rayovac 6V Rechargeable Battery,Rebit 500 GB USB 2.0 External Hard Drive with Backup Software RSA525500,RVLA,RSA525500,Rayovac,Rebit,0.0,64.99
1915,5601,Draper AT Grey Targa Acoustically Transparent Screen - 108 diagonal Widescreen Format,rooCASE Multi-Angle Black Leather Folio Case Cover for Samsung GALAXY Tab 10.1 Wi-Fi NOT Compatible with Verizon 4G LTE,116236,,Draper,rooCASE,2965.95,25.0
2307,4588,Crown Super-Soaker Polypropylene Wiper Mat With Gripper Bottom 45 X 67 Dark Brown,NETGEAR FS108 ProSafe 8-Port 10 100 Desktop Switch,SSR046DB,FS108NA,Crown,Netgear,139.97,40.99
1295,5493,Avery Shipping Labels with TrueBlock Technology 8-1 2 x 11 White 25 Pack,SONIX TravelBook for iPad 2 Grey Felt 203-0402-001,8165,203-0402-001,Avery,Sonix,11.94,35.67
595,4953,Uniden D2998 DECT 6.0 Loud and Clear Digital Answering System with Cordless Handset,2 HP Remanufactured Black 21 Ink Cartridges,D2998,,Uniden,Unknown,79.93,10.99
536,15663,USB Night Vision Webcam 640 x 480,Pilot 35113 - VBall Roller Ball Stick Liquid Pen Blue Ink Fine Dozen,U05502,,,Pilot,24.98,
763,20406,Draper Glass Beaded Access Series M Manual Screen - 8 x 10 AV Format,New-Cord Organizer Multi Pack White Case Pack 2 - 511471,203037,,Draper,3M,956.5,44.0
1792,20554,Crown Tire-Track Scraper Needlepunch Polypropylene Vinyl Mat 48 X 72 Gray,Okidata Ribbon for Pacemark 4410 Printer Black,TE0046GY,40629302,Crown,Oki Data,124.97,32.04
1690,18250,Smead Acid-Free Poly Folder 2 Fasteners 1 3 Cut Top Tab Letter Manila 24 Box,Belkin A3L791B10 CAT5E Patch Cable 10 feet,10545,A3L791B10,,Belkin,42.94,3.95
896,11939,Diaper Dude Black Coated Grey Digi Laptop Sleeve 13,Clarion NX501 6.2 Double-DIN Navigation Multimedia Control Station,207492,NX501,Diaper Dude,Clarion Mobile Electronics,32.0,
150,18141,Imation 43347 DDS-2 Data Cartridge,New-2.4GHz Wireless Laser Mouse With Storable Nano Receiver - BH1631,43347,,Imation,V7,10.88,26.49
1047,11862,Instant Play Piano Deluxe V3.0,iHome iHM60LT Rechargeable Mini Speaker Blue Translucent,81050,iHM60LT,Topics Ent,iHome,34.98,17.99
2045,4350,jWIN Bluetooth Keyboard for iPad iPhone,750GB Diskgo Backup Portable USB 2.0 3.5IN,IBTKB20BLK,EDGDG-214616-PE,JWin,Edge,63.88,90.75
185,9070,Los Angeles Dodgers Pink iPhone 4 Hard Case,University Of Iowa Iphone 3G Case,FVA4450,811398017361,Tribeca,Pangea Brands,29.99,19.99
1779,12150,Walmart Family Mobile 3-line Package,RAB STL110HW Stealth Motion Sensor with 110 Degree View and Par-38 Bell Flood Lighting Kit White,,RAB STL110HW,,RAB Lighting,179.88,86.99
696,19883,Clarion Sirius Satellite Radio Receiver Adapter,Epson 78 Light Cyan Ink Cartridge T078520,CLASC1,T078520,Clarion,Epson,49.99,11.67
1768,19749,Oki 433244 Toner 5000 Page-Yield,Belkin A3L791-14-BLU-S RJ45M RJ45M 14-Feet 10 100BT CAT5E Snagless Patch Cable Blue,4.332442E7,A3L791-14-BLU-S,OKI,Belkin,100.0,5.11
2254,17677,VisonTek Wireless CandyBoard Mini Keyboard with Touchpad,Ampad 25159 - Multi-Subject Notebook College Medium Rule Ltr White 240 Sheets,900319,,Visiontek,Ampad,59.82,
1501,6003,REDIFORM OFFICE PRODUCTS                           Brownline Weekly Appointment Book w 30-Minute Schedule 7-5 8 x 10-1 4 Black 2012,Zeikos ZE-CA38B Deluxe Soft Small Camera and Video Bag,,ZE-CA38B,REDIFORM OFFICE PRODUCTS,Zeikos,22.29,4.87
1862,11910,Innovera D2130B Black Compatible High-Yield Toner Print Cartridge,Denon DP-200USB Fully Automatic Turntable with MP3 Encoder,D2130B,DP-200USB,INNOVERA,Denon,58.9,
2198,20749,Peerless SmartMount Universal Tilt Mount 23 - 46 Screens,Hewlett Packard 1-pack DDS-4 40GB 150m Data Cartridge C5718A,ST640,C5718A,Peerless,HP,86.99,10.04
1659,4298,Cables To Go 12 CMG-Rated HD15 SXGA M M Monitor Projector Cable with Rounded Low Profile Connectors,Sony ALCSH109 Alpha Lens Hood for the SAL2875 Lens,40143,ALCSH109,Cables To Go,Sony,19.0,33.49
997,17359,Maxell Timbers Wood Earbuds Oak,Blow Molded Case in Black 10 x 13.5 x 3.25,190243 TEB-O,,Maxell,Platt,29.88,28.99
261,11721,Oki 52102001 Ribbon Black,Stanley Bostitch 02210 - Electric Stapler with Anti-Jam Mechanism 20-Sheet Capacity Black,5.2102001E7,,OKI,Stanley,14.0,50.27
1778,15999,Panasonic KXFA132 Film Cartridge and Film Roll,Tamper-Resistant Outlet Nightlight-White,KXFA132,,Panasonic,Use Manufacturer Vendor,49.84,16.32
519,1309,Seal Shield SSK107 Medical Grade Keyboard - Dishwasher Safe Black USB,Verbatim SuperSpeed 2 TB USB 3.0 Desktop External Hard Drive 97415 Black,SSK107,97415,Seal Shield,Verbatim,30.84,122.31
1864,16830,Lexar Media LJDFF2GBASBNA 2GB JumpDrive FireFly USB 2.0 Flash Drive,New-Oxford 73153 - Card Guides Alpha 1 5 Tab Polypropylene 3 x 5 25 Set - ESS73153,LJDFF2GBASBNA,,Lexar Media,Oxford,13.88,18.0
848,2096,SKB Cases LS Series Luggage Style Transport Case 7 11 16 H x 21 1 8 W x 15 3 4 D outside,TDK LTO Ultrium Universal Cleaning Cartridge,9P2014-01BE,D2404-CCAX,SKB Cases,TDK,114.99,48.25
983,19928,Startech 10 ft. HD 15mm VGA Monitor Cable,STEELMASTER by MMF Industries 221612003 - Heavy-Duty Steel Cash Box w 7 Compartments Latch Lock Sand,MXT101MM10,,StarTech,STEELMASTER by MMF Industries,10.98,
2232,21208,jWIN Caf Nites In-Ear Earphones Pink,New-C9202MH Toner 14000 Page Yield Magenta Case Pack 1 - 516737,IEP222PNK,,iLuv,Lexmark,9.88,970.4
284,5205,Tribeca Varsity Jacket Silicone Case for iPod Touch University of Florida,Wintec Filemate 32 GB Professioal CompactFlash Card,FVA3615,3FMCF32GBP-R,Tribeca,Wintec,18.9,92.99
2033,19885,CyberPower 2800 Joules 8 Oulet Surge Protector,ENDUST for Electronics 100 Non-Flammable 10 oz Duster with Bitterant 255050,880,255050,CyberPower,Norazza,23.88,11.39
727,15807,Cobra 14-Band Digital Radar Laser Detector,Icon Black Nylon Laptop Case 17IN,XRS 9545,CB117-BLK,COBRA,Motion Systems,122.84,11.99
311,12751,Logitech USB Webcam C270H,LOWRANCE 000-0140-05 HDS7 BASE US 83 200 KHZ FISHFINDER,C270H,,Logitech,Lowrance,29.0,1150.0
999,1733,Western Digital AV-GP 320GB SATA Desktop Internal Hard Drive,Plantronics Voyager PRO Bluetooth Headset,WD3200AVVS,Voyager PRO,Western Digital,Plantronics,51.7,69.99
1613,21075,3M Porcelain Marker Board Steel Backed 4 x3 Aluminum,Tektronix Waste Cartridge for Phaser 7400,,106R01081,3M,Tektronix,246.59,29.99
1944,2904,Kenwood 6  5-Way Performance Series Flush Mount Speakers 500 Watts,Kensington 72121 Mouse-in-a-Box Optical Elite USB Mouse PC Mac,KFC-6993PS,72121,Kenwood,Kensington,84.99,18.0
24,20813,Avery Shipping Labels for Color Laser   Copier 3-3 4 x 4-3 4 Matte White 100 Pack,Santa Cruz 16GB Dead Pool SkateDrive USB Flash Drive,,,Avery,Action,16.67,
1927,20622,Inland ProHT Film Screen Protector for iPad,Antec TriCool 92mm DBB Case Fan with 3-Spd Switch 3 4-Pin 3-Pin Monitoring,08562,TriCool 92mm DBB,Inland,Antec,14.99,8.25
506,4286,Kodak Essentials Large Hard Camera Case,Audiovox Sirius SUPH1 Dock Play Home Kit Black,1753284,SUPH1,Kodak,Sirius Satellite Radio,13.88,37.24
1649,19618,Smead Folder Manila 50 Box,EDGE - Memory - 1 GB 2 x 512 MB - DIMM 240-pin - DDR2 - 800 MHz PC2-6400 - unbuffered - non-ECC,,K1240-209506-PE,,Edge,39.94,30.36
1430,14951,CoolMax 3.5  USB 3.0 External Hard Drive Enclosure Black,HON 512PP - 510 Series Two-Drawer Full-Suspension File Letter 29h x25d Black,HD-381BZ-U3,,Coolmax,Hon,26.88,302.0
2510,14530,MSI Black 20  Wind Touch AE2050-008 All-in-One Desktop PC with AMD Dual-Core E-350 Processor and Windows 7 Home Premium,Canon VIXIA HF R20 Full HD Camcorder with 8GB Internal Flash Memory Silver,9S6-AC3112-008,R20-Silver,MSI,Canon,679.0,369.0
1373,11468,Dymo File Folder Labels 2-up,Sony Clie PEG-NZ90 Handheld,30277,PEG-NZ90,Dymo,Sony,10.88,
2442,3025,Samsung EC-ST65ZZBPU Indigo Blue 14.2MP Digital Camera w 5x Optical Digital Camera 2.7  LCD Display w 50 Bonus Prints,Human Toolz Portable Lap Desk for 13-17-Inch Macbooks and Notebooks SLD101B,EC-ST65ZZBPU,SLD101B,Samsung,Human Toolz,84.0,27.99
1755,11057,Dixie Heavyweight Knives 100ct,Kingston 8 GB DDR2 SDRAM Memory Module 8 GB 2 x 4 GB 667MHz DDR2 SDRAM KTH-XW667 8G,KH207,KTH-XW667/8G,Dixie,Kingston,7.15,220.74
2453,3907,Seal Shield SSKSV107 SILVER SEAL Medical Grade Keyboard - Dishwasher Safe   Antimicrobial Black  USB,Corsair Force 3 60 GB SATA III 6.0 Gb-s 2.5-Inch Solid State Drive CSSD-F60GB3-BK,SSKSV107,CSSD-F60GB3-BK,Seal Shield,Corsair,38.84,114.99
2268,5077,Cooler Master Storm 17  SF-19 Laptop Cooler,Garmin GPSMAP 78 2.6-Inch Marine GPS Navigator and Worldwide Chartplotter,SGA-6000-KKYF1,010-00864-00,Coolermaster,Garmin,83.75,299.88
459,1644,V7 25 CAT5e Snagless Network Patch Cable Yellow,Wagan EL2402 SmartAC 200W Power Inverter with USB Port,V7N3C5E-25F-YLWS,EL2402,V7,Wagan,6.88,32.18
2481,12827,PC Treasures Casual Game Treasures 5pk with 2GB USB Flash Drive PC,Lenovo Thinkpad Business Backpack 43r2482,50482,43R2482,PC Treasures,Lenovo,12.92,47.99
1092,11745,HON 600 Series Two-Drawer Lateral File Black,PC Treasures FlipIt Reversible Sleeve for 10-Inches Neoprene Tablet PC - Red Black 07102,682LP,07102,HON,PC Treasures,449.94,8.82
1455,5249,Lexmark X644A11A Black Toner Print Cartridge,Verbatim Clip-IT 4 GB USB 2.0 Flash Drive 97556 Pink,X644A11A,97549,Lexmark,Verbatim,326.24,10.98
1785,2926,Dell SWITCH by Design Studio Lids Big Giant Plaid 17R,Jabra C250 EarWave Boom Headset for 2.5mm Plugs,9VMV5,C250,Dell,Jabra,39.0,2.65
1494,20578,Energizer Zero Mercury 357 Battery 3pk.,Studio Moviebox Plus USB2 Video Capture Device,962266,8230-10022-31,Energizer,Pinnacle,0.0,
1574,6286,StarTech 3 Slim 3.5mm Right Angle Stereo Audio Cable M M,Audiovox XMEXT50 50 Foot Indoor Outdoor Antenna Cable Extension,MU3MMS2RA,XMEXT50,StarTech,Audiovox,7.88,34.8
1855,17579,Apple iPod nano 8GB Charcoal,New-Universal 73700 - Manila File Jackets with Reinforced Tabs Two Inch Expansion Letter - UNV73700,MC688LL/A,,Apple,Universal,134.54,49.0
438,6133,Atlantic Drawbridge Multimedia Storage Unit Black Wood,Pioneer TSD1602R 6.5 Inch Two-Way Speakers with 260 Watts Max Power,3793-5622,TS-D1602R,Atlantic,Pioneer,41.89,
204,13605,Sharpie Pen Retractable Fine Point Pens Black Set of 2,RCA Wall Plate with 2 Solder-Type RCA Jacks,,,Sharpie,Factory Buyouts,5.88,0.98
1460,18611,Sentry Headart Extreme Folding Headphones Black,Motion Activated Alarm with Auto Dialer,SENTRY DJ STYLE BK,72-1613,Sentry,Trademark Global,12.98,35.4
1803,11664,HP 58 Photo Inkjet Print Cartridge C6658AN,Razer Goliathus Standard Speed Dragon Age II Mouse Pad RZ02-00211800-R3M1,C6658AN,RZ02-00211800-R3M1,HP,Razer,28.88,23.99
1848,12460,Boise Fireworx Colored Cover Stock Paper 250 Sheets - Available in Various Colors,Digipower iEssentials Mini Laptop Cooling Station IE-LCS2,MP2651BE,IE-LCS2,Boise,DigiPower,10.47,11.0
431,17122,Mobile Edge 16PC 17Mac Premium Leather V-Load,New-HON 692LP - 600 Series Two-Drawer Lateral File 42w x19-1 4d Black - HON692LP,118607,,Mobile Edge,Hon,111.99,772.0
1407,8700,Advantus Translucent Retractable ID Card Reel 4pk Assorted Colors,Microsoft Wireless Mobile Mouse 3500 - Jamison Artist Series  GMF-00090,75464,GMF-00090,,Microsoft,10.94,22.74
189,9064,Middle Atlantic Remote Control Switch,HC Matte White Advantage Electrol - Wide Format Size Wide 94 diagonal,USC-KL,,Middle Atlantic,Da-Lite,80.99,
497,8989,Case Logic Universal Pocket- Camouflage,PNY v125 8 GB USB Flash Drive P-FD8GBHP125-AZ,122245,P-FD8GBHP125-AZ,Case Logic,HP,9.59,11.99
180,10185,Compucessory Compucessory Foldable Noise Canceling Headphones Black,Pioneer TS-G6842R 6-Inch X 8-Inch 2-Way 180-Watt Speakers Pair,CCS59224,TSG6842R,Compucessory,Pioneer,52.99,32.0
953,17031,Draper M1300 Signature Series V Electric Screen  - NTSC 11 diagonal,Oxford 12706 - PressGuard Coated Report Cover Prong Clip Letter 3 Capacity Black,100321,,Draper,Oxford,3600.0,
1650,150,iFrogz iPod Touch 4 Luxe Lean Case Pink,Elite Manual SRM M120XWV2-SRM - Projection screen - 120 in 305 cm - 4 3 - MaxWhite - white,IT4LL-PNK,M120XWV2-SRM,iFrogz,Elite,24.99,
1093,16479,OCZ Technology Vertex 2 60GB 2.5  SATA II Solid State Drive,Vivitar High Defifinition 43X Wide Angle 58MM,OCZSSD22VTXE60G,VIV-43-58W,OCZ Technologies,Vivitar,119.98,17.99
20,2545,HP 80 Ink Printhead Printhead Cleaner Black C4890A,Compatible Black Toner Cartridge for LaserJet Pro P1606dn Printer Replaces HP CE278A,C4890A,P1606dn,HP,Generic,268.79,12.3
1836,16040,Eco-Products Flat Compostable Cold Drink Cup Lids 1000ct,StarTech.com USB to PS2 Keyboard and Mouse Adapter USBPS2PC,EPFLCC,USBPS2PC,,StarTech,81.97,12.76
1510,12500,Imation 16GB Pocket Flash Drive,Corsair Dominator GT 6 GB PC3-16000 2000Mhz Triple Channel Core i3 i5 i7 DDR3 Memory Kit CMT6GX3M3A2000C8,27861,CMT6GX3M3A2000C8,Imation,Corsair,58.88,
237,18600,GE RG6 Coax Cable 25,New-Best-Rite 2029C - Ultra-Trim Magnetic Board Dry Erase Porcelain Steel 48 x 33 3 4 White Silver - BLT2029C,33282,,GE,Best Rite,0.0,277.0
381,2996,Cables To Go 2m VGA Video Cable Adapter,iLuv iCC616BLK Flexi-Metallic TPU Case with 3D Pattern for iPod Touch 4G Black,54187,iCC616BLK,Cables To Go,iLuv,46.77,6.99
618,6444,Clarion CZ101 Single CD MP3 WMA AAC Receiver,Cyber Acoustics Mono Mini Headset Microphone with in-line volune mute AC-740,CZ101,AC-740,Clarion,Cyber Acoustics,89.99,11.0
1554,5419,Elite ELECTRIC120V Screens Spectrum Electrol Projection Screen,StarTech.com HDMIMM30 30 feet HDMI to HDMI Digital Video Cable,ELECTRIC120V,HDMIMM30,Elite Screens,StarTech,189.0,43.24
827,917,Email Delivery Tracfone 450-Minutes Wireless Airtime Card,Kensington 62238 Contour Backpack,9840,62238,Tracfone,Kensington,79.88,61.24
1013,2370,Panasonic In-Ear Clip Earphone for iPhone iPod Black,AUDIOVOX CORP-HEADPHONES HP245 RCA FOLDING SPORT,RP-HSC200-K,,Panasonic,Audiovox,39.88,7.61
2342,14614,Green Onions Supply 10.1  Anti-Glare Screen Protector,Microsoft Wireless Mobile Mouse 3500 - Moore Artist Series  GMF-00091,RT-SPFG101W/M,GMF-00091,Green Onions Supply,Microsoft,22.88,19.99
831,6341,3M Dry-Erase Board w Marker Accessory Tray 8 x4 Mahogany,Aluratek USB 2.0 2.5-Inch 3.5-Inch SATA Portable External Hard Drive Docking Enclosure AHDDU100F,,AHDDU100F,3M,Aluratek,771.59,24.99
1421,19402,Avery Laser CD Labels Glossy 40-Count,PNY 4 GB SDHC Class 2 Flash Memory Card P-SDHC4G2-EF BLUE Blue,05694,P-SDHC4G2-EF/BLUE,Avery,PNY,20.15,17.99
1091,1045,Serif WebPlus Essentials,HP 88 Black Ink Cartridge in Retail Packaging C9385AN 140,WPEUSDVDRT,C9385A,Serif,HP,44.82,
1234,180,ACD Systems ACDSee Pro 4-Box Full Version,Samsung EC-WB210 Digital Camera with 14 MP 12x Optical Zoom and Touchscreen Black,ACDCD70845WI,EC-WB210ZBPBUS,ACD Systems,Samsung,239.99,209.0
1664,7162,Level Mount Motorized Full Motion Mount For Flat Screen TV s 10 - 42 Screens,Energizer Ultimate L92BP-4 Lithium AAA Battery 4 Pack,,L92BP4,Level Mount,Energizer,199.99,8.45
220,9646,Microsoft Wireless Mobile Mouse 4000 SGKomen Pink,Oklahoma City Thunder iPhone 4 Case Silicone Cover,D5D-00052,,Microsoft,Tribeca,20.0,17.99
89,22033,BALT Wheasel Easel Adjustable Melamine Dry Erase Board White,Pro Series 12ft Telephone Handset Cord,33250,F8V101-12-BK,Balt,Belkin,239.88,2.99
719,10022,Motorola Thrill Me Purple EH25 Stereo Headset,JLab Audio Miniblaster Portable Speaker for iPod nano 2G White,89273N,MBWG2,Motorola,JLAB,24.88,23.24
1716,5986,Safco Stow And Go Cart Black,Aluratek Hi Res USB 2.0 to DVI Adapter Dual Display Support,4054BL,AUD200F,,Aluratek,49.0,57.85
2284,5993,Plantronics H91CIS Encore H91 Headset,Acer AS7551G-6477 17.3-Inch Laptop Mesh Black,H91CIS,AS7551G-6477,Plantronics,Acer,119.88,729.99
1086,18859,Rubbermaid Commercial 48-72 Quick-Connect Ergo Adjustable Handle,Grado Statement Series GS1000i Headphones,Q760,GS1000i,Rubbermaid Commercial,Grado,15.97,995.0
1904,20250,Microsoft Laptop Roller Bag Destination,Black Gray Original Joby Gorillapod Universal Digital Video Camera Tripod w Flexible Legs GP1-A1EN,39203,,Microsoft,KarenDeals,102.88,26.95
1636,3743,Canon 0904B001AA LUCIA Photo Cyan Ink Tank for Image PROGRAF iPF9000 Printer,Panasonic RP-HJE280-S Inner Ear Earbuds w Extension Silver,0904B001AA,RP-HJE280-S,Canon,Panasonic,294.0,14.51
1968,10665,Chief Manufacturing Universal Dual Swing Arm LCD Wall Mount in Silver 26 - 40 Screens,Microsoft Arc Mouse - Red,,ZJA-00002,Chief Manufacturing,Microsoft,199.2,28.0
1876,19889,TP-Link TL-ANT2409B 2.4GHz 9dBi Outdoor Directional Antenna,Duracell 32 GB Class 4 Secure Digital Card DU-SD-32GB-R,TL-ANT2409B,DU-SD-32GB-R,TP Link,Dane-Elec,27.88,47.99
902,18631,Level TV Wall Mount Full-Motion Mount for 10-30  Flat-Panel TVs DC30T,Adobe Creative Suites Premium 2.3 Upgrade from CS2 Old Version,DC30T,28040557,Level Mount,Adobe,35.0,
1127,9689,Cocoon Innovations Grid-It Large Organizer for Roller Bag Black,Q-See QSDL506W Wireless Home Security Alarm System Kit DIY,CPG51BK,QSDL506W,COCOON INNOVATIONS,Digital Peripheral Solutions,29.99,62.96
2422,6415,Safco Public Square Brown Steel Recycling Container 42 gal,New Digital Camera Hard Carry Case Blue for SONY CANON CASIO JVC Cameras 1 Super Fine Microfiber Cleaning Cloth Goja Logo,2984BR,,Safco Products,Goja,246.97,9.99
2332,16609,Visual Land V-Motion Pro 4GB MP3 Player,Holoscreen Rear Projection Screen - 66 x 101 Video Format,ME9644GBBLK,,Visual Land,Da-Lite,39.88,7400.0
2260,10361,IOGEAR 1GB Mobile USB 2.0 Scribe Digital Pen Flash Drive,Apple iPhone 3G 3GS iPhone3G NCAA Skin Nebraska Cornhuskers Hard Case Cover Faceplate Snap On Housing Protector,GPEN300,Apple iPhone 3G / 3GS,IOGEAR,Apple,74.88,14.99
2198,348,Peerless SmartMount Universal Tilt Mount 23 - 46 Screens,Brother DR360 Drum Unit,ST640,DR360,Peerless,Brother,86.99,64.95
1982,21333,HP 82 High-Capacity Black Inkjet Cartridge CH565A,HP 49 Tri-Color Ink Cartridge in Retail Packaging,HP CH565A,51649A,HP,HP,39.88,1.29
2144,14910,Link Depot 14 Ethernet Enhanced CAT6 Networking Cable Blue,HQRP Wall Travel AC Power Adapter Battery Charger compatible with AC-S5220E Sony eBook Reader Digital Book Replacement plus HQRP Coaster,C6M-14-BUB,,Link Depot,HQRP,3.98,8.91
566,5145,Victor 1570-6 Desktop Two-Color Printing Calculator,EDGE - Memory - 1 GB - DIMM 184-pin - DDR - 266 MHz PC2100 - 2.5 V - registered - ECC,15706,D2184-182458-PE,Victor,Edge,199.88,40.69
440,3799,BIC Ultra Round Stic Grip Ball Pen Blue 1-Dozen 3-Pack,GTMax Durable PU Texture Leather Protector Cover Case - Black for RIM Blackberry Playbook Tablet,,0088515811861,,GTMax,4.53,12.99
2291,4678,Orbital Tilt and Turn TV Wall Mount with Glass Shelving for 25-40  TVs,Marware MicroShell for iPad Clear,RESL422B-E,602956006671,Orbital,Marware,0.0,6.49
2296,3077,Lexmark 18C2249 36XL 37XL High-Yield Ink 500 Page-Yield 2 Pack Black,Hi-Capacity Main battery for DELL Latitude X300,18C2249,B-5796-AZ36483,Lexmark,Battery-Biz,66.99,43.99
1684,21281,Scosche Dash Install Kit for 1995 and Newer Ford Mercury Lincoln Mazda,New-AUDIO TECHNICA ATH-CKL200WH IN-EAR HEADPHONES WHITE - ATHCKL200W,FD2080,,Scosche,Audio-Technica,12.21,27.0
1265,5332,Just Wireless Multi Tip Car AC Phone Charger,Toshiba 6-Cell Replacement Li-Ion Battery Pack for 10 Thrive Tablet PA3884U-1BRR,04222,PA3884U-1BRR,Just Wireless,Toshiba,0.0,69.99
1435,17257,Mainstays Computer Stand,New-Verbatim 95237 - Store n Go PRO USB Flash Drive 4GB - VER95237,MS11-021-208-63,,Mainstays,Verbatim,0.0,58.0
1438,16819,Plantronics USB-To-Headset Adapter,New-Post-it C50 - Notes Dispenser with Weighted Base Plastic 12 x 8 x 2 Charcoal Gray - MMMC50,DA-40,,Plantronics,Post-It,27.98,41.06
265,5429,Rubbermaid Rotary Desk Organizer w Supplies Black,StarTech 3.5-Inch to 5.25-Inch Floppy Mounting Kit Bracket Black Plastic,25001,BRACKETFDBK,Rubbermaid,StarTech,21.94,8.99
1355,14079,Virginia Tech Hokies iPhone 4 Case Black Shell,MEDIA SCIENCES MS5000K Laser toner okidata c5000 series 42127404 compatible black,FVA3168,MS5000K,Tribeca,Media Science,29.99,20.15
495,17790,3M Address Labels 3700-C,New-Coated Paper Report Cover Tang Clip Letter 1 2 Case Pack 1 - 443740,3700-C,,3M,Oxford,19.97,67.87
828,7100,Sceptre 24  ultra-slim E240LC-FHD,Oxford 5062523 - Contour Two-Pocket Paper Folder 150-Sheet Capacity Dark Blue,E240LC-FHD,,Sceptre,Oxford,179.0,27.16
2184,17191,HP C8560A Drum Unit,Polycom Communicator C100S Blue,C8563A,2200-44000-001,HP,Polycom,671.69,107.55
1620,7496,Scosche Dual 12V Power Socket,Sony DCR-SR68 80GB Hard Disk Drive Handycam Camcorder Red,IU2PS,DCR-SR68/R,Scosche,Sony,14.88,328.0
640,7606,Audiosource BI5 5  In-Wall Construction Bracket Mount,Samsung CLP-Y660B - Toner cartridge - 1 x yellow - 5000 pages,BI5,CLP-Y660B,AudioSource,Samsung,25.88,118.22
1263,20971,Manfrotto Unica V DSLR Messenger Bag,New-CD DVD Storage Drawer Holds 150 Discs 6 7 10 x 12 Case Pack 1 - 515769,MB-SM390-5BC,,Manfrotto,Innovera,89.99,55.36
1724,4027,Five Star 1-Subject Wirebound Wide Rule Trend Notebook Blue 5 pack,Westinghouse LD-3255VX 32-Inch 720p LED HDTV Black,,LD-3255VX,,Westinghouse,9.5,394.46
645,8081,Case Logic 17  Rolling Laptop Case,Transcend StoreJet 640 GB USB 2.0 Portable External Hard Drive TS640GSJ25M Black,VNR-217BLACK,TS640GSJ25M,Case Logic,Transcend,76.88,79.73
2533,13177,Draper Cineflex Cineperm Fixed Frame Screen - 7 6 diagonal NTSC Format,Elite Screens VMAX2 Electric projection Screen 4 3 Aspect Ratio-84in Max White,251013,VMAX84XWV,Draper,Elite,416.7,248.37
1994,10736,Link Depot 10 Ethernet Enhanced CAT6 Networking Cable Red,Logitech Professional Presenter R800 with Green Laser Pointer,C6M-10-RDB,910-001350,Link Depot,Logitech,4.68,61.55
1962,19800,Arkon Mini Friction Dashboard Windshield Cell Phone Mount,New-MACALLY POWERLINK8 IPOD IPHONE BATTERY CHARGER - MCYPRL8,SM512,,Arkon,Macally,18.97,43.0
1818,19601,Avery Durable View Binder with 1  EZ-Turn Ring 3-Pack Bundle,Hi-Capacity Camcorder Digital Camera Battery Charger for Canon Panasonic Sony,,CH-9000,,Battery-Biz,6.68,50.48
2457,20381,Seagate FreeAgent GoFlex eSATA Cable,Cables Unlimited ZipLINQ ZIP-PWR-DCA iPod Firewire to Car Power Adapter White,STAE103,ZIPPWRDCA,Seagate,Cables Unlimited,12.98,4.49
1324,18529,Verbatim 500GB CLLN USB Portable Hard Drive 97060,New-Tripp Lite P560006 - P560-006 6ft DVI Dual Link TMDS Cable DVI-D M M 6 - TRPP560006,97060,,Verbatim,Tripp Lite,77.84,43.0
1186,1386,Griffin iPad Airstrap,Transcend 32 GB JetFlash 500 Retractable USB Flash Drive Amazon Frustration Free Package - TS32GJF500 Black Purple,GB01759,TS32GJF500E,Griffin Technology,Transcend,39.99,39.99
872,6946,AOC 2236VW 22  Widescreen LCD Monitor in Piano Black,iHome iDM70BC iPad Case with Built-In Rechargeable NXT Flat-Panel Stereo Speakers Black,2236VW,iDM70BC,AOC,iHome,129.0,
2325,326,Motorola Netopia 3346N-ENT Broadband Router,New-HP Basic Carrying Case - AJ078AA,3346N-ENT,,Motorola,HP,103.84,38.45
