ID_A,ID_B,Flag,Title_A,Title_B,ISBN13_A,ISBN13_B
3227,2401,,The Autobiography of Thomas Jefferson,The Autobiography of a Journalist,,2.94003E+12
2300,1641,,Tosh An Autobiography,Seeds of Violence: The Autobiography of a Subversive,9.78021E+12,9.7816E+12
649,1611,,Against The Evil Tide - An Autobiography,Autobiography and correspondence during the reigns of James I and Charles I : Edited,,2.94002E+12
3046,2254,,The Autobiography of Saint Therese: The Story of a Soul,The Real McRae: The Autobiography of the People's Champion,9.78031E+12,9.78009E+12
1418,1096,,Reaching for the Beaufort Sea: An Autobiography,The Autobiography of W. E. B. Du Bois (The Oxford W. E. B. Du Bois): A Soliloquy on Viewing My Life from the Last Decade of Its First Century,9.78155E+12,9.7802E+12
124,3696,,The Tribal World of Verrier Elwin: An Autobiography,"Alton Locke ; tailor and poet, an autobiography",9.7802E+12,2.94002E+12
2900,3436,,Death Valley in '49: The Autobiography of a Pioneer,Lazar: The Autobiography of My Father,,9.78067E+12
116,2037,,They Shall Not Pass: The Autobiography of La Pasionaria,Life and labours of the Rev. Wm. McClure [microform] : for more than forty years a minister of the Methodist New Connexion : chiefly an autobiography,9.78072E+12,2.94003E+12
2730,1795,,The Autobiography of our Beloved,"Autobiography Of The Blessed Mother Anne Of Saint Bartholomew, Inseparable Companion Of Saint Teresa, And Foundress Of The Carmels Of Pontoise, Tours And Antwerp",,9.7813E+12
3006,1058,,"In Review Pictures I've Kept A concise Pictorial ""Autobiography""","The Path of The White Magus: A Supernatural, Metaphysical Autobiography",,9.78058E+12
160,2580,,Autobiography of Thomas Jefferson & the Jefferson Bible: The Life and Morals of Jesus of Nazareth,"Deeper Experiences Of Famous Christians: Gleaned From Their Biographies, Autobiographies And Writings",9.78098E+12,9.7813E+12
987,2480,,Luckier Than Most: An Autobiography,"Louisiana, Napoleon and the United States: An Autobiography of Pierre-Clement de Laussat (1756-1835)",9.78034E+12,9.78082E+12
1116,2875,,Red Auerbach: An Autobiography,"Edward Wortley Montagu, Vol. 2 of 3: An Autobiography (Classic Reprint)",9.7804E+12,9.78133E+12
3141,2701,,An Uncertain Voyage: An Autobiography,"The Wondrous Autobiography Of Leaf, Erik's Son",9.7819E+12,9.78098E+12
3909,13,,Autobiography of a Mad Nation,The Autobiography of Eleanor Roosevelt,9.78817E+12,9.78006E+12
1971,1318,,Autobiography,Theme And Variations An Autobiography - Scholar's Choice Edition,9.78072E+12,9.7813E+12
1707,2714,,Accept The Challenge � The Autobiography,The Autobiography of Alexander Luria A Dialogue With the Making of Mind,,9.78081E+12
2776,172,,From Annapolis to Scapa Flow: The Autobiography of Edward L. Beach Sr.,"The Last Manchu: The Autobiography of Henry Pu Yi, Last Emperor of China",9.78156E+12,9.78163E+12
2289,937,,Women's Autobiography,"The Gift of Stories: Practical and Spiritual Applications of Autobiography, Life Stories, and Personal Mythmaking / Edition 1",9.78025E+12,9.7809E+12
2758,609,,Patterns Of Experience In Autobiography,Without Stopping: An Autobiography,9.78081E+12,9.78006E+12
1121,2642,,Heir Apparent: An Autobiography,"The autobiography and justification of Johannes Ronge, tr. [from Rechtfertigung]",9.7802E+12,2.94003E+12
3449,2655,,Peig: The Autobiography of Peig Sayers of the Great Blasket Island,The Autobiography of Madame Guyon,9.78082E+12,9.7815E+12
1235,2761,,Porn King: The Autobiography of John C. Holmes,Jane Eyre: An Autobiography - Scholar's Choice Edition,,9.7813E+12
1054,286,,Autobiography of Mother Jones,Ansel Adams: An Autobiography / Edition 1,9.78049E+12,9.78082E+12
3417,2695,,My American Journey: An Autobiography,Meaning a Life: An Autobiography,9.78068E+12,9.78088E+12
2456,289,,"My History, Not Yours: The Formation of Mexican American Autobiography",THE AUTOBIOGRAPHY OF MARK TWAIN Nook Edition (100th Anniversary Newly Edited and Commented Version) Special Nook Enabled Features The Autobiography of Mark Twain NOOKbook,9.7803E+12,2.94001E+12
425,2312,,A Sole Survivor: Bits of Autobiography,Rudolf Steiner: An Autobiography,9.78157E+12,9.78083E+12
2065,3504,,Undisputed Trut: My Autobiography,"Theodore Thomas, a musical autobiography;",,2.94002E+12
448,151,,"Benjamin O. Davis, Jr., American: An Autobiography","Autobiography of Mark Twain: Volume 1, Reader's Edition",9.78087E+12,9.78052E+12
2775,2175,,Leading from the Front: The Autobiography. General Sir Richard Dannatt,"Autobiography of Dr. D. B. Kellogg: Or, Explanation of Clairvoyance ...",9.78055E+12,2.94002E+12
1854,97,,Telling Lies in Modern American Autobiography,"Complete Works of Henry James: Novels, Short Stories, Plays, Essays, Autobiography and Letters: The Portrait of a Lady, The Wings of the Dove, The American, The Bostonians, The Ambassadors, What Maisie Knew, Washington Square, Daisy Miller...",9.78081E+12,9.78803E+12
715,1472,,Things I remember: An autobiography,Chapters of Experience: Studies in 20th Century American Autobiography,9.78081E+12,9.78031E+12
3015,1484,,Sing As We Go: The Autobiography of Gracie Fields,Autobiography Of A Mysterious Man,,9.78145E+12
1427,615,,The Machine: The Autobiography of Ian Freeman,Hound Dog: The Leiber and Stoller Autobiography,9.7819E+12,9.78142E+12
3690,2661,,Steve Jobs Bio: The Unauthorized Autobiography,Autobiography of Lorenzo Waugh (Classic Reprint),,9.78133E+12
2450,5,,"Super Bowl Diary: The Autobiography Of Ken ""The Snake"" Stabler",A Dog's Life: The Autobiography of a Stray,9.78052E+12,9.78044E+12
1169,1271,,Thank Heaven: My Autobiography,Phases of opinion and experience during a long life [microform] : an autobiography,9.78191E+12,2.94003E+12
1795,548,,Reminiscences of a Soldier's Wife: An Autobiography,"Autobiography of a Fugitive Negro: His Anti-Slavery Labours in the United States, Canada, & England",9.78055E+12,9.78385E+12
2644,642,,Autobiographies (Erasmus editions),Outside the Magic Circle: The Autobiography of Virginia Foster Durr,9.78093E+12,9.78082E+12
139,3648,,The Autobiography and Sex Life of Andy Warhol,Taken Alive and Other Stories with an Autobiography,9.78097E+12,9.78151E+12
3025,3290,,Davy Crockett's Own Story as Written by Himself: The Autobiography of America's Great Folk Hero,Autobiography_of_seventy_years_vol-I,9.78068E+12,2.94002E+12
425,3524,,A Sole Survivor: Bits of Autobiography,Autobiography of Catherine Joss,9.78157E+12,2.94002E+12
2149,1051,,Autobiography of Allen Jay,"A Burlesque Autobiography and, First Romance",,2.94001E+12
2157,311,,The Autobiography of Jack Ketch (1835),The Autobiography of Peter Cartwright,9.7811E+12,2.94015E+12
1580,271,,Survivor: The Autobiography,Writing Your Life: A Guide to Writing Autobiographies,9.78185E+12,9.78162E+12
944,187,,Who On Earth Is Tom Baker? An Autobiography,Infinity Net: The Autobiography of Yayoi Kusama,9.78E+12,9.78185E+12
3073,2747,,A Corpse In The Well: Translations From Modern Marathi Dalit Autobiographies,"Autobiography of the Rev. Dr. Alexander Carlyle, minister of Inveresk, 1722-1805",9.78086E+12,2.94003E+12
1735,362,,The Autobiographies of Sean O'Casey,The Autobiography of Yukichi Fukuzawa / Edition 1,9.78063E+12,9.78023E+12
1783,176,,The Doctor's House: An Autobiography,Time to Be in Earnest: A Fragment of Autobiography,9.7819E+12,9.78035E+12
3484,2565,,My England Years: The Autobiography,The magic staff; an autobiography of Andrew Jackson Davis ..,9.78076E+12,2.94002E+12
1679,2473,,Darwin Compendium: Voyage of the Beagle/Origin of the Species/Descent of Man & Selection in Relation to Sex/Expression of Emotions in Humans & Animals/Autobiography,Valentina: The Exile Child: An autobiography,9.78076E+12,9.78058E+12
2804,3029,,Treat It Gentle: An Autobiography,"The Lady Ecclesia, an autobiography",9.78031E+12,2.94002E+12
182,1109,,The Crafty Cockney: Eric Bristow: The Autobiography,Bright Felon: Autobiography and Cities,9.78185E+12,9.78082E+12
1793,2348,,Enigma Spy: An Autobiography,Autobiographies: Poems,9.78071E+12,9.78014E+12
3518,3084,,My People Shall Live: Autobiography Of A Revolutionary,Against the Odds: An Autobiography,9.78092E+12,9.78009E+12
3285,3537,,Autobiography and Reminiscences of Theophilus Noel,Bob Wilson: My Autobiography,9.78112E+12,9.78184E+12
283,2531,,An Autobiography,"An Autobiography, The Story Of The Lord's Dealings With Mrs. Amanda Smith, The Colored Evangelist: Containing An Account Of Her Life Work Of Faith, And Her Travels In America, England, Ireland, Scotland, India, And Africa, As An Independent",,9.7813E+12
2620,2818,,An Autobiography of Lessons Learned,ADHD: An Autobiography of Survival,9.78148E+12,9.78095E+12
2726,1386,,"His Majesty, the Queen: An Autobiography",Autobiography of seventy years,9.78069E+12,2.94002E+12
368,1725,,Memoirs of an Arabian Princess: An Autobiography,"John M. Mwanakatwe: Teacher, Politician, Lawyer: My Autobiography",,9.78998E+12
1989,1458,,Blues All Around Me: The Autobiography of B.B. King,Caroline Herschel's Autobiographies,9.78038E+12,9.78091E+12
314,3003,,Autobiography of a Yogi,Lew Wallace: An Autobiography (Classic Reprint),,9.78143E+12
2148,3268,,Within the Family Circle: An Autobiography,Select Poems and Autobiography (Classic Reprint),9.78043E+12,9.78133E+12
585,2390,,The Saint: My Autobiography,Children of the Dead End; The Autobiography of a Navvy,9.78034E+12,9.78131E+12
3027,1158,,Paper Bullets: A Fictional Autobiography,An Autobiography: The Story of the Lord's Dealings with Mrs. Amanda Smith the Colored Evangelist,9.7803E+12,9.7802E+12
2772,2068,,Autobiography and National Identity in the Americas Autobiography and National Identity in the Americas,Awakening Desert: The Autobiography of an Israeli Scientist,9.78081E+12,9.78965E+12
3962,1996,,"The Limits of Autobiography: Trauma, Testimony, Theory","Autobiography of the late Donald Fraser, D.D. [microform] : and a selection from his sermons",9.7808E+12,2.94003E+12
1968,2261,,Autobiography,"Charles Francis Adams, 1835-1915: An Autobiography",9.78078E+12,2.94002E+12
2752,3462,,On Superconductivity and Superfluidity: A Scientific Autobiography,"When the Tree Flowered: The Fictional Autobiography of Eagle Voice, a Sioux Indian",9.78354E+12,9.7808E+12
1982,187,,Autobiography,Infinity Net: The Autobiography of Yayoi Kusama,9.78146E+12,9.78185E+12
2523,144,,Sage Tea: An Autobiography,"Biography: Best Sellers! Mother Teresa ( autobiography, diary, journal, life, life story, memoir, picture, profile, sketch, confessions, experience, letter, life history, personal account )",9.78E+12,2.94015E+12
2415,2514,,Yellow & Green: Not an Autobiography of Marcy Chen,Breaking Stereotypes: Autobiography of James O. Terry Jr.,9.78062E+12,9.78146E+12
3942,97,,Autobiography of Peter Cartwright,"Complete Works of Henry James: Novels, Short Stories, Plays, Essays, Autobiography and Letters: The Portrait of a Lady, The Wings of the Dove, The American, The Bostonians, The Ambassadors, What Maisie Knew, Washington Square, Daisy Miller...",9.78069E+12,9.78803E+12
825,1678,,"Living My Life, Vol. 1: Autobiography: 001",Hashish: The Autobiography of a Red Sea Smuggler,,9.78088E+12
1627,2556,,With Louis and the Duke: The Autobiography of a Jazz Clarinetist,Is it That Time Already?: The Autobiography,9.7802E+12,9.78185E+12
2409,992,,An Autobiography: The Story of My Life and Work,The Unbelonger : The Autobiography of a Half-Jewish Girl in Hitler's Berlin,,9.78193E+12
3614,2676,,"The Crippled Tree (China : Autobiography, History, Book 1)","Autobiography of Z. S. Hastings, Written for His Boys",9.78059E+12,9.78146E+12
2166,1200,,"Reed Anthony, Cowman: An Autobiography",Reputations Live on: An Early Malay Autobiography,,9.78052E+12
1434,1888,,Bitch! The Autobiography of Lady Lawford,Tone on Tone/Of All That Is: The Spiritual Autobiography of Kenneth Grahame,,9.78148E+12
2841,538,,"Hummingbirds to Elephants and Other Tales; Autobiography of Murray E. Fowler, DVM","The Literature of Ancient Egypt: An Anthology of Stories, Instructions, Stelae, Autobiographies, and Poetry / Edition 3",9.78096E+12,9.7803E+12
899,2622,,Mummy's Boy: My Autobiography. by Larry Lamb,"Autobiography, letters and literary remains of Mrs. Piozzi (Thrale)",9.78144E+12,2.94002E+12
2865,2040,,The Fiction of Autobiography: Reading and Writing Identity,The Autobiography of Dayanand Saraswati,,2.94001E+12
41,3482,,Omnibus: The Complete Autobiography,Autobiography of Friedrich Froebel,9.78041E+12,2.94002E+12
3499,2854,,Falwell: An Autobiography,The Revelation of a Star's Endless Shine: A Young Woman's Autobiography of a 20-Year Tale of Trials and Tribulations,9.78189E+12,9.78062E+12
1708,2189,,Autobiography: A Reader For Writers,The Autobiography of Kevin M. McCarthy,9.7802E+12,9.78151E+12
414,232,,The Autobiography of Martin Van Buren,"Grown Gray in War: From Iwo Jima to the Chosin Reservoir to the Tet Offensive, the Autobiography of a True Marine Hero",9.78118E+12,2.94015E+12
3602,2343,,The Autobiography,Achsa: An Autobiography,9.78184E+12,9.78189E+12
3592,2530,,Annie Besant: An Autobiography,Something Like an Autobiography,9.78143E+12,2.94001E+12
2661,273,,"Under My Skin: Volume One of My Autobiography, to 1949","Three Negro Classics: Up from Slavery, The Souls of Black Folk, The Autobiography of an Ex-Colored Man",9.78006E+12,9.78038E+12
1818,1590,,Maradona: The Autobiography of Soccer's Greatest and Most Controversial Star,"Autobiography of Thomas Wilkinson Wallis : sculptor in wood, and extracts from his sixty years' journal ..",,2.94002E+12
846,2891,,Ron Santo: For Love of Ivy - The Autobiography of Ron Santo,The Autobiography of St Ignatius,9.78093E+12,9.78178E+12
1684,931,,The Autobiography of Jack Woodford,"His Majesty, the Queen: An Autobiography",,9.78069E+12
1171,455,,The Fantastic Lodge: The Shocking Autobiography of a Girl Addict,Ansel Adams: An Autobiography,,9.78082E+12
235,566,,On the Side of the Angels: Autobiography,"Best of the Sellers George Washington Carver ( autobiography, diary, journal, life, life story, memoir, picture, profile, sketch, confessions, experience, letter, life history, personal account )",9.78075E+12,2.94015E+12
3023,3343,,Les Brownlee: The Autobiography of a Pioneering African-American Journalist,Million Dollar Mermaid: An Autobiography,9.78193E+12,9.78079E+12
1712,2019,,An Open Book - My Autobiography,A Portuguese Colonial in America: Belmira Nunes Lopes: The Autobiography of a Cape Verdean-American,,9.78094E+12
2253,1144,,The Face:An Autobiography.,"Little Masterpieces ; Selections From Autobiography, Poor Richard's Almanac, Advice to a Young Tradesman, the Whistle, Necessary Hints to Those That Would Be Rich, Motion for Prayers, Selected Letters",9.78086E+12,9.78129E+12
1977,2333,,An Autobiography,When a Blind Man Perceives...: The Autobiography of Donald D.Vess,9.78145E+12,9.78147E+12
2106,2606,,Rhinestone Cowboy An Autobiography,"The Bishop, the Hunchback, & the Lunatic: The Autobiography of a Mad-Doctor",9.78085E+12,9.78148E+12
3143,1357,,Living Without Love: An Autobiography,Autobiography of Francis Torrey Townsend...,9.7806E+12,9.78131E+12
3964,1839,,"Pauli Murray: The Autobiography of a Black Activist, Feminist, Lawyer, Priest, and Poet",The Autobiography of Jack the Ripper: As Revealed to Clanash Farjeon,9.78087E+12,9.78089E+12
3082,3224,,"Baby Zeke: Into the Mine: The diary of a chicken jockey, book 2 (an unofficial Minecraft autobiography) (Baby Zeke the Chicken Jockey)",From Labor to Letters: A Novel Autobiography,,9.78093E+12
3946,725,,Confessions of a Dangerous Mind: An Unauthorized Autobiography (Confessions of a Dangerous Mind #1),Bushwhacker: Autobiography of Samuel S. Hildebrand,9.78079E+12,2.94015E+12
654,293,,The Autobiography of S. S. McClure,My Inventions (Rediscovered Books): The Autobiography of Nikola Tesla,9.7808E+12,9.78163E+12
2085,921,,How to Be Seventy: An Autobiography,"I Came, I Saw: An Autobiography",9.78023E+12,9.78148E+12
2023,2311,,And One To Grow On (American Autobiography),"Queen Vashti: The Autobiography of a Guernsey cow : her Owners, Companions, Caretakers, Ancestors and Descendants",9.78078E+12,9.7813E+12
2940,2695,,Israel Rank: The Autobiography of a Criminal,Meaning a Life: An Autobiography,,9.78088E+12
2028,2505,,Journey with Children: The Autobiography of a Teacher,"The Life of William Carleton, Vol. 2: Being His Autobiography and Letters; And an Account of His Life and Writings, From the Point at Which the Autobiography Breaks Off (Classic Reprint)",9.78087E+12,9.78133E+12
2875,1301,,The Unknown Star: The Autobiography Of Elton Rokusek,Mucking about: An Autobiography,9.78098E+12,9.78188E+12
1906,348,,I Wanted to Be an Actress - The Autobiography of Katharine Cornell,"Works of James Fenimore Cooper: (35 Works). Includes The Last of the Mohicans, Homeward Bound, Autobiography of a Pocket-Handkerchief and more",9.78141E+12,9.78161E+12
2058,3387,,Reg Gutteridge: My Autobiography,Autobiography of a Small Town Coach,9.78186E+12,9.78126E+12
2085,1868,,How to Be Seventy: An Autobiography,Harcourt School Publishers Trophies: On-Lvl:Autobiography/Dog G6 AUTOBIOGRAPHY/DOG,9.78023E+12,9.78015E+12
966,2714,,Darling: A Spiritual Autobiography,The Autobiography of Alexander Luria A Dialogue With the Making of Mind,9.78067E+12,9.78081E+12
2738,1336,,Soldier: The Autobiography,As If: An Autobiography,9.78059E+12,9.78047E+12
1681,2314,,The Autobiography,"Autobiography and Letters of Orville Dewey, D. D (Classic Reprint)",9.78072E+12,9.78133E+12
2756,2091,,The Autobiography of Charles Darwin,Secret Selves: Confession and Same-Sex Desire in Victorian Autobiography,,9.78081E+12
2951,3657,,Autobiography and Black Identity Politics: Racialization in Twentieth-Century America,A Fragment Of Autobiography,9.78052E+12,2.94002E+12
2230,2240,,A Foot In Both Worlds: A Doctor's Autobiography Of Psychic Experience,Our Irish Theatre: A Chapter of Autobiography (Classic Reprint),9.78086E+12,9.78133E+12
3538,3028,,Autobiography,Gewaad Van Rouw: An Autobiography of an Extreme Calvinistic Upbringing,9.78075E+12,9.78146E+12
2091,3371,,"Experiment in Autobiography, Vol 2",Lawman-an Autobiography,9.78057E+12,9.78023E+12
2800,1672,,An Autobiography or the Story of My Experiments with Truth: A Table of Concordance,My Autobiography and Reminiscences,9.78042E+12,9.78131E+12
750,335,,"Midlife Queer: Autobiography of a Decade, 1971-1981",Something Like An Autobiography,9.7803E+12,9.78031E+12
774,71,,INXS: Story to Story: The Official Autobiography,"I, Claudius: From the Autobiography of Tiberius Claudius",,2.94015E+12
929,2545,,"Autobiography of Andrew George Salzer, an American Life",A Labor of Love: An Autobiography,9.78098E+12,9.78074E+12
2123,434,,The Autobiography of Ralph de Boissiere,Rome: The Autobiography,,9.78178E+12
1466,2967,,"""Blackcat"" The Autobiography of a Feral Cat","Autobiography, 1800-1875",,2.94002E+12
914,2025,,Diary of a Minecraft Bat: (an unofficial Minecraft autobiography),A Sailor's Story: The Autobiography of Percy Paul Provost,,9.78141E+12
1054,27,,Autobiography of Mother Jones,"Play On: Now, Then, and Fleetwood Mac: The Autobiography",9.78049E+12,9.78032E+12
3077,647,,Things I Couldn't Tell My Mother: My Autobiography,HOPEFUL - an autobiography,9.78009E+12,9.78147E+12
1721,2707,,Letters to His Family: An Autobiography,Autobiography of William G. Schauffler: For Forty-nine Years a Missionary in ...,9.78081E+12,2.94003E+12
1539,494,,Frame of Mind: The Autobiography of the World Snooker Champion,HELEN KELLER: THE TWO AUTOBIOGRAPHIES The Story of My Life,9.78184E+12,2.94001E+12
3111,3466,,Life of a Rolling Stone: Autobiography,From the Hills of Georgia: An Autobiography in Paintings,9.78092E+12,9.78032E+12
2684,2123,,Mark Twain's Own Autobiography,The Stories of My Life: A Kibbutznik's Autobiography,9.78074E+12,9.78126E+12
442,2039,,Autobiography,The World's Most Successful Failure - An Autobiography,,9.78178E+12
983,2954,,The Sand Man: An Autobiography,Reminiscences of foreign travel. A fragment of autobiography,9.78158E+12,2.94002E+12
3856,40,,Billy the Kid: An Autobiography,An Ordinary Man: An Autobiography,,9.78014E+12
263,2386,,Assisted: An Autobiography,"The Picture - A Nosegay For Amateurs, Painters, Picture-Dealers, Picture-Cleaners, Liners, Repairers, And All The Craft - Being The Autobiography Of A Holy Family, By Raphael, Faithfully Written From Actual Dictation Of The Picture Itself",,9.78145E+12
3409,2614,,After Confession: Poetry as Autobiography,The autobiography of a Spanish adventurer,9.78156E+12,2.94002E+12
3038,1431,,"Three and Two! The Autobiography of Tom Gorman, the Great Major League Umpire",Jenny Pitman: The Autobiography,9.78068E+12,9.78145E+12
1732,1489,,Scu: The Autobiography Of A Champion,The Life and Times of the Rev. Robert Burns ... Including an Unfinished Autobiography,9.78075E+12,9.7813E+12
1251,1939,,Unlikely Spy: An Autobiography,"It Is What It Is: Systematic Incarceration / Disguised Racism - The Autobiography of Gerald H. Duffy, Jr.",9.78075E+12,2.94003E+12
3516,1002,,Daughter Of Destiny: An Autobiography,A Daughter of Han: The Autobiography of a Chinese Working Woman,9.78067E+12,9.7808E+12
720,1751,,Emlyn (Autobiography #2),Take It Like a Man: The Autobiography of Boy George,9.78037E+12,9.78006E+12
151,2749,,I Know Nothing: The Autobiography,Storm in a C Cup: My Autobiography,9.78185E+12,9.78147E+12
3561,2111,,Twiggy: An Autobiography,"Autobiography of Thomas Guthrie, and Memoir",9.78025E+12,9.78133E+12
3783,3231,,Hoyt Street: An Autobiography,"A Better Class of Person: An Autobiography, 1929-1956",9.78083E+12,9.78057E+12
3612,3264,,The Way It Was: My Autobiography,Black Bolshevik: Autobiography of an Afro-American Communist,9.78075E+12,9.78093E+12
3191,237,,The Autobiography Of Denis Zachaire,All in a Lifetime: An Autobiography,9.78156E+12,9.78045E+12
253,3051,,In My Own Way: An Autobiography,A Trooper In The 'Tins' Autobiography Of A Lifeguardsman,9.78158E+12,9.78185E+12
2811,2486,,Putting the Record Straight: The Autobiography of John Culshaw,History of Psychology in Autobiography / Edition 1,9.78067E+12,9.78039E+12
2660,2666,,Autobiography of Benvenuto Cellini,"Autobiography of James Silk Buckingham, Vol. 2 (Classic Reprint)",9.78143E+12,9.78133E+12
1512,3194,,Finding My Way: Autobiography of an Optimist,"An Autobiography My Schools and Schoolmasters; or, the Story of My Education",9.78097E+12,9.78143E+12
2969,2990,,What's Welsh for Zen: The Autobiography of John Cale,Wandering recollections of a somewhat busy life : an autobiography,9.78158E+12,2.94002E+12
706,2742,,"Ehanamani ""Walks Among"": An Autobiography",An Accidental Autobiography,9.78096E+12,9.7804E+12
3490,2674,,Dreaming to Some Purpose: The Autobiography of Colin Wilson,The Pioneer Preacher: An Autobiography - Scholar's Choice Edition,9.78184E+12,9.7813E+12
3123,898,,Dalglish: My Autobiography,Ba,9.78034E+12,9.78151E+12
149,1092,,Time and Space: A Poetic Autobiography,Autobiography of a Yogi: A 52-Card Deck & Booklet,9.7806E+12,9.78157E+12
1009,2314,,"Josyp Terelya, Witness to Apparitions and Persecution in the USSR: An Autobiography","Autobiography and Letters of Orville Dewey, D. D (Classic Reprint)",9.78188E+12,9.78133E+12
3507,708,,World War II: The Autobiography,The Autobiography Of Abbie Hoffman,9.78076E+12,9.78157E+12
2414,1293,,"As I Remember, Adam: An Autobiography of a Festival",The Autobiography of Benvenuto Cellini,,2.94002E+12
1244,3614,,Shocking Life: The Autobiography of Elsa Schiaparelli,"An Autobiography: In Three Parts, With Essays (Classic Reprint)",9.78185E+12,9.78133E+12
205,779,,The Autobiography of Abraham Lincoln (Classic Reprint),"Burn, Ba",,9.78025E+12
3242,1653,,Autobiography of Dan Young,Life and Letters of Sir Charles Hall: Being an Autobiography 1819-1860 (Classic Reprint),,9.78133E+12
657,137,,Joking Apart: My Autobiography,The Story of a Soul (L'Histoire d'une Ame): The Autobiography of St. Therese of Lisieux With Additional Writings and Sayings of St. Therese,9.78185E+12,2.94002E+12
1377,2698,,The Autobiography and Maxims of Master Han Shan,Street Fighting Years: An Autobiography of the Sixties,,9.78184E+12
303,959,,Stalker! Chris Walker: The Autobiography,Autobiography of Goethe: Truth and Poetry Relating to My Life,9.78001E+12,9.78178E+12
2816,377,,Holy Boldness: Women Preachers' Autobiographies And The Sanctified Self,Man Who Lives in Paradise: Autobiography of A. C. Gilbert with Marshall McClintock,9.78157E+12,9.78091E+12
2372,2240,,The Autobiography of James T. Kirk,Our Irish Theatre: A Chapter of Autobiography (Classic Reprint),,9.78133E+12
425,1547,,A Sole Survivor: Bits of Autobiography,One and Only Second Autobiography of Ralph Miller: The Dog Who Knew He Was a Boy,9.78157E+12,9.78093E+12
824,2052,,My Autobiography,Not Much of an Engineer: An Autobiography,9.78032E+12,9.78156E+12
1596,542,,Autobiography of an Actor,From the Deep Woods to Civilization: Chapters in the Autobiography of an Indian (Illustrated),,2.94002E+12
3848,1191,,The Real West Marginal Way: A Poet's Autobiography,Jumbo's Keeper: The Autobiography of Matthew Scott and His Biography of P. T. Barnum's Great Elephant Jumbo,9.78039E+12,9.78148E+12
2206,2888,,"Looking Forward, Looking Back: An Autobiography","Autobiography of Samuel S. Hildebrand, the renowned Missouri bushwhacker ... being his complete confession",9.78034E+12,2.94002E+12
1144,714,,Hazel Court - Horror Queen: An Autobiography,The Milesian Mistress. The Autobiography of Aspasia of Miletus,9.78095E+12,2.94001E+12
2297,181,,Autobiography of an Englishman,"Hitler Biography: Best Seller! Standing Down Hitler ( autobiography, diary, journal, life, life story, memoir, picture, profile, sketch, confessions, experience, letter, life history, personal account )",9.78086E+12,2.94015E+12
97,676,,If everyone cared: Autobiography of Margaret Tucker,Toussaint L'Ouverture: A Biography and Autobiography,,9.78163E+12
